key,0s,1s,2s,3s,4s,6s,outs,balls
"V Kohli, JDS Neesham",1,4,0,0,0,1,0,6
"KC Sangakkara, DL Vettori",17,15,0,0,7,0,1,39
"STR Binny, S Nadeem",7,4,2,0,0,0,0,13
"CH Gayle, AJ Finch",0,0,0,0,1,4,0,5
"AJ Finch, MG Johnson",22,8,2,0,5,0,3,37
"SK Warne, Shakib Al Hasan",1,1,0,0,0,0,0,2
"R Ashwin, A Mithun",0,1,0,0,0,0,0,1
"SV Samson, MC Henriques",8,8,2,0,1,1,0,20
"AC Voges, J Theron",3,1,0,0,0,0,0,4
"BB McCullum, MJ Clarke",5,9,0,0,1,0,0,15
"KD Karthik, A Symonds",1,2,0,0,1,0,1,4
"M Manhas, JH Kallis",1,2,1,0,2,0,1,6
"Shoaib Akhtar, DJ Thornely",4,1,0,0,0,0,0,5
"SK Trivedi, SL Malinga",3,0,0,0,0,0,0,3
"DT Christian, AL Menaria",0,2,0,0,0,0,0,2
"DJ Bravo, B Lee",12,3,1,0,2,0,0,18
"JEC Franklin, A Ashish Reddy",2,0,0,0,0,0,1,2
"C de Grandhomme, YS Chahal",5,1,1,0,0,0,1,7
"DJ Hussey, P Negi",1,3,0,0,1,0,0,5
"Azhar Mahmood, GJ Maxwell",0,1,0,0,1,2,0,4
"AJ Finch, DJ Bravo",0,2,0,0,0,0,0,2
"GC Smith, P Kumar",25,8,0,0,2,0,2,35
"MF Maharoof, Iqbal Abdulla",2,3,1,0,0,0,1,6
"Azhar Mahmood, DT Christian",1,3,0,0,0,0,0,4
"K Rabada, MJ McClenaghan",1,3,0,0,0,0,0,4
"YK Pathan, A Kumble",3,4,0,1,0,0,1,8
"ML Hayden, V Kohli",3,1,0,0,2,0,0,6
"MS Bisla, PP Ojha",3,2,0,0,1,0,2,6
"SP Narine, JD Unadkat",8,2,0,0,1,0,1,11
"DJ Bravo, BAW Mendis",1,2,0,0,0,0,0,3
"GC Smith, SK Raina",4,10,1,0,0,1,1,16
"HH Gibbs, Mashrafe Mortaza",0,0,1,0,0,0,0,1
"Yuvraj Singh, JH Kallis",9,16,4,0,7,3,2,39
"AP Tare, Sandeep Sharma",4,5,0,0,0,1,1,10
"S Dhawan, J Botha",14,14,0,0,2,0,2,30
"RG Sharma, J Syed Mohammad",1,5,0,0,1,0,0,7
"JDP Oram, RA Jadeja",0,1,0,0,0,0,0,1
"MM Sharma, DT Christian",1,1,0,0,0,0,0,2
"Imran Tahir, STR Binny",2,0,0,0,0,0,1,2
"WD Parnell, MM Patel",1,1,0,0,0,0,1,2
"LJ Wright, P Kumar",1,0,2,0,2,1,0,6
"PA Patel, DS Kulkarni",10,4,0,0,4,1,2,19
"KC Sangakkara, Y Nagar",0,1,0,0,2,0,0,3
"SS Iyer, Anureet Singh",4,4,0,0,2,0,0,10
"R Ashwin, SR Watson",2,3,0,0,0,0,1,5
"RV Uthappa, A Mithun",1,0,0,0,1,0,0,2
"JD Ryder, RP Singh",3,0,1,0,2,0,0,6
"AM Rahane, STR Binny",6,6,0,0,5,0,0,17
"AD Mathews, B Lee",0,1,1,0,1,0,0,3
"AM Rahane, Kuldeep Yadav",3,2,0,0,1,0,0,6
"Y Venugopal Rao, AB McDonald",2,0,1,0,0,0,1,3
"KM Jadhav, AR Patel",1,1,0,0,0,0,1,2
"DJ Harris, VR Aaron",1,1,0,0,1,0,0,3
"S Sriram, AB Agarkar",0,2,0,0,1,0,0,3
"S Dhawan, RS Bopara",3,0,1,0,0,0,1,4
"IR Jaggi, A Singh",3,1,0,0,2,0,0,6
"NV Ojha, DJ Bravo",10,4,1,0,0,0,1,15
"SR Watson, AD Russell",4,9,2,0,4,0,0,19
"JD Ryder, Z Khan",2,6,2,0,3,1,0,14
"SPD Smith, KV Sharma",19,19,5,0,4,2,1,49
"A Symonds, A Kumble",5,5,2,0,1,0,2,13
"KK Nair, K Santokie",3,2,2,0,1,1,0,9
"RR Powar, Z Khan",2,3,1,0,0,0,0,6
"BJ Hodge, JH Kallis",5,10,2,1,3,0,0,21
"AD Mathews, IK Pathan",4,7,3,0,0,0,1,14
"S Badrinath, FH Edwards",3,1,0,0,0,0,0,4
"Shakib Al Hasan, BA Bhatt",2,1,0,0,0,0,0,3
"CH Gayle, Shakib Al Hasan",6,5,0,0,2,4,0,17
"PC Valthaty, TL Suman",0,2,1,0,0,1,0,4
"HH Gibbs, SP Narine",11,5,1,0,2,1,0,20
"Azhar Mahmood, JA Morkel",2,0,0,0,1,0,0,3
"WP Saha, S Kaul",1,1,0,0,0,0,1,2
"A Mishra, TG Southee",1,1,0,0,0,0,0,2
"M Vohra, MA Starc",3,1,1,0,0,0,1,5
"S Badrinath, JD Ryder",3,3,0,0,2,0,0,8
"G Gambhir, TS Mills",7,1,1,0,0,1,1,10
"KK Cooper, SL Malinga",2,1,0,0,0,1,0,4
"R Ashwin, J Theron",2,0,0,0,0,0,0,2
"MJ Clarke, SR Watson",3,2,1,0,1,0,0,7
"A Mishra, TS Mills",1,2,1,0,0,0,0,4
"A Nehra, SP Narine",1,0,0,0,0,0,1,1
"BB McCullum, MM Sharma",4,2,0,0,1,0,2,7
"Yuvraj Singh, Anureet Singh",2,1,0,0,0,1,1,4
"AB Dinda, R Vinay Kumar",1,0,0,0,0,0,0,1
"KL Rahul, R Vinay Kumar",4,6,2,0,0,0,0,12
"WP Saha, Basil Thampi",1,1,1,0,0,1,0,4
"HM Amla, CJ Jordan",0,3,0,0,0,0,0,3
"Yuvraj Singh, P Amarnath",1,4,0,0,1,1,1,7
"SS Tiwary, SC Ganguly",0,2,0,0,0,1,0,3
"Q de Kock, A Nehra",5,1,0,0,3,1,0,10
"CJ Anderson, Mohammed Shami",1,1,0,0,1,0,0,3
"CH Gayle, LJ Wright",6,6,0,0,1,1,0,14
"RG Sharma, K Rabada",1,0,0,0,0,0,1,1
"JH Kallis, STR Binny",0,1,0,0,0,0,0,1
"AB de Villiers, AR Patel",11,16,3,0,3,1,1,34
"AJ Finch, A Nehra",6,4,0,0,0,0,0,10
"CJ Anderson, DW Steyn",4,0,0,0,0,0,1,4
"KK Nair, JP Faulkner",2,0,0,0,0,0,1,2
"PA Reddy, M Muralitharan",1,0,0,0,0,0,1,1
"MD Mishra, R Vinay Kumar",0,3,0,0,0,0,0,3
"R Vinay Kumar, B Lee",5,3,2,0,0,1,0,11
"MG Johnson, MM Sharma",1,3,0,0,2,0,0,6
"TL Suman, L Balaji",0,1,0,0,0,0,0,1
"Q de Kock, SA Yadav",0,1,0,0,1,0,0,2
"R Vinay Kumar, LR Shukla",1,0,0,0,0,0,0,1
"Mohammed Shami, P Negi",2,1,0,0,0,0,1,3
"C Munro, JJ Bumrah",2,1,0,0,0,0,0,3
"SK Raina, SB Wagh",0,0,0,0,1,0,0,1
"S Dhawan, AM Salvi",0,2,0,0,1,0,0,3
"DJ Bravo, Mustafizur Rahman",3,1,0,0,0,0,0,4
"LR Shukla, A Singh",1,0,0,0,0,0,0,1
"DR Smith, Shakib Al Hasan",10,3,0,0,4,2,2,19
"AP Dole, DS Kulkarni",0,1,2,0,0,1,0,4
"KD Karthik, Harbhajan Singh",5,8,0,0,0,0,1,13
"Joginder Sharma, Z Khan",1,4,1,0,0,0,0,6
"BJ Hodge, P Awana",3,4,0,0,1,0,0,8
"BA Bhatt, A Mishra",5,0,0,0,0,0,0,5
"M Manhas, M Muralitharan",4,2,0,0,0,0,1,6
"A Zampa, Z Khan",1,0,0,0,0,0,0,1
"R Vinay Kumar, SK Warne",1,2,0,0,0,1,0,4
"JJ Bumrah, B Kumar",0,1,0,0,0,0,0,1
"DR Smith, YK Pathan",2,3,2,0,0,1,1,8
"JJ van der Wath, S Randiv",1,0,0,0,0,0,0,1
"DT Christian, AN Ahmed",2,1,1,0,0,1,0,5
"GC Smith, K Goel",1,2,0,0,1,0,0,4
"WP Saha, P Kumar",10,9,3,0,2,2,0,26
"Shakib Al Hasan, M Muralitharan",4,5,1,0,0,0,0,10
"HH Pandya, YS Chahal",1,1,0,1,0,1,1,4
"P Dogra, PD Collingwood",0,3,1,0,0,0,0,4
"DJG Sammy, S Nadeem",3,3,0,0,0,0,0,6
"R Bhatia, L Balaji",1,0,0,0,1,0,1,2
"PJ Sangwan, A Nehra",1,0,0,0,0,0,1,1
"MC Henriques, MM Sharma",6,3,1,0,3,0,0,13
"TM Head, MM Sharma",0,1,0,0,0,0,0,1
"Q de Kock, Sandeep Sharma",5,3,0,0,1,0,0,9
"LA Pomersbach, M Muralitharan",7,4,0,0,0,0,1,11
"N Saini, P Negi",2,2,0,0,1,0,0,5
"MK Pandey, SB Jakati",3,3,2,0,1,0,1,9
"BA Stokes, Swapnil Singh",0,4,0,0,0,1,0,5
"MA Starc, MM Sharma",2,3,0,0,1,0,1,6
"IK Pathan, P Parameswaran",0,1,0,0,0,0,0,1
"MS Dhoni, SB Bangar",4,2,3,0,0,0,0,9
"AM Rahane, S Kaul",2,10,1,0,1,0,0,14
"SC Ganguly, Z Khan",10,2,0,0,1,0,2,14
"MC Henriques, K Rabada",0,2,0,0,2,0,0,4
"MK Tiwary, DL Vettori",1,4,0,1,0,0,0,6
"TL Suman, SR Watson",1,0,0,0,1,0,1,2
"MA Agarwal, HH Pandya",1,0,0,0,0,0,0,1
"SE Marsh, S Tyagi",2,2,0,0,0,0,0,4
"HH Gibbs, M Ntini",11,0,0,0,2,1,1,14
"RJ Harris, JP Faulkner",1,2,0,0,0,0,0,3
"MJ Lumb, DR Smith",0,1,0,0,2,0,0,3
"SS Tiwary, RN ten Doeschate",2,3,0,0,0,0,1,5
"KH Pandya, NM Coulter-Nile",0,3,1,0,0,0,0,4
"KD Karthik, A Nehra",14,14,1,0,6,1,3,36
"IK Pathan, R Vinay Kumar",2,5,0,0,2,0,0,9
"SR Watson, JE Taylor",1,1,0,0,0,0,0,2
"NV Ojha, A Mishra",5,6,2,0,5,3,2,21
"EJG Morgan, NLTC Perera",2,0,1,0,3,1,0,7
"DA Miller, KV Sharma",7,8,1,0,1,2,1,19
"Rashid Khan, BA Stokes",1,1,1,0,0,0,0,3
"CH Gayle, JH Kallis",19,12,1,0,5,2,2,39
"DA Warner, AM Nayar",0,7,0,0,1,0,0,8
"KB Arun Karthik, Harbhajan Singh",2,2,0,1,0,0,1,5
"RS Bopara, RP Singh",6,1,1,0,1,0,0,9
"VR Aaron, TA Boult",0,1,0,0,0,0,0,1
"WP Saha, VS Malik",0,2,0,0,0,0,0,2
"BB McCullum, BA Stokes",4,5,1,0,2,1,0,13
"P Kumar, YS Chahal",2,1,0,0,0,0,0,3
"HH Pandya, TA Boult",3,2,1,0,2,1,0,9
"V Sehwag, P Kumar",22,7,3,0,12,3,2,47
"AP Tare, MA Starc",2,1,0,0,0,0,0,3
"KM Jadhav, PV Tambe",1,3,0,0,0,0,0,4
"Shakib Al Hasan, JDS Neesham",0,2,0,0,0,0,0,2
"DJG Sammy, UT Yadav",3,1,1,0,0,0,0,5
"SC Ganguly, RR Raje",2,2,0,0,1,0,0,5
"MS Dhoni, RJ Peterson",1,1,2,0,1,1,0,6
"MK Pandey, LR Shukla",1,2,0,0,1,0,0,4
"GC Smith, A Kumble",3,9,0,0,0,1,0,13
"Shoaib Malik, DJ Bravo",0,2,2,0,0,0,0,4
"JDP Oram, WA Mota",2,7,1,0,0,0,0,10
"BB Samantray, R Sharma",8,4,1,0,1,1,1,15
"S Dhawan, Mohammed Shami",9,5,1,0,6,0,0,21
"YV Takawale, SP Narine",8,3,1,0,1,0,1,13
"J Botha, BA Bhatt",1,1,0,0,0,0,1,2
"Mandeep Singh, T Natarajan",2,2,0,0,3,2,0,9
"RG Sharma, KP Pietersen",3,3,1,0,0,1,0,8
"MA Agarwal, MG Johnson",3,6,0,0,2,1,1,12
"JA Morkel, JP Faulkner",0,1,0,0,0,0,0,1
"AA Bilakhia, SM Harwood",1,0,0,0,0,0,1,1
"PC Valthaty, CK Langeveldt",5,1,1,0,1,1,1,9
"G Gambhir, YS Chahal",4,7,3,0,3,0,2,17
"MN van Wyk, GR Napier",3,3,0,0,0,0,1,6
"SS Tiwary, Azhar Mahmood",0,1,0,0,0,0,0,1
"WA Mota, Z Khan",0,1,0,0,0,0,0,1
"SE Marsh, RJ Harris",1,0,0,0,0,0,1,1
"SD Chitnis, AD Russell",2,2,0,0,3,0,1,7
"BMAJ Mendis, JA Morkel",3,2,0,0,0,0,0,5
"CH Gayle, AR Patel",13,4,0,0,1,8,2,26
"Iqbal Abdulla, MF Maharoof",1,1,0,0,0,0,0,2
"PA Patel, Mohammed Shami",13,10,1,0,3,0,1,27
"Shakib Al Hasan, MG Johnson",4,1,3,0,1,0,0,9
"R Ashwin, BB Sran",4,2,1,0,1,0,1,8
"KK Nair, S Badree",2,1,0,0,0,0,1,3
"Shahid Afridi, A Mishra",1,0,0,0,0,0,1,1
"SS Tiwary, DT Christian",2,3,1,0,0,0,0,6
"SP Narine, Washington Sundar",1,1,0,0,0,0,0,2
"A Nehra, DJ Bravo",1,0,0,0,0,0,1,1
"KA Pollard, SN Thakur",1,2,0,0,0,0,0,3
"MV Boucher, L Balaji",2,4,0,0,1,0,0,7
"T Kohli, B Geeves",2,1,0,0,0,0,0,3
"DR Smith, J Suchith",7,3,0,0,4,3,0,17
"JP Duminy, SK Warne",8,12,0,0,1,1,1,22
"Sandeep Sharma, YS Chahal",1,1,0,0,1,0,1,3
"S Nadeem, BCJ Cutting",2,0,0,0,0,0,1,2
"RS Bopara, Imran Tahir",2,5,0,1,0,1,0,9
"AT Rayudu, MA Starc",1,0,1,0,0,0,1,2
"A Mishra, JP Faulkner",3,0,0,0,0,0,1,3
"Y Venugopal Rao, R Dhawan",1,1,0,0,2,0,0,4
"AP Tare, JD Unadkat",0,0,0,0,2,0,0,2
"S Aravind, Basil Thampi",0,2,0,0,0,0,0,2
"MC Henriques, MA Starc",0,1,1,0,0,0,0,2
"RG Sharma, MS Gony",1,4,0,0,2,2,0,9
"SV Samson, Harbhajan Singh",13,18,5,0,4,2,0,42
"SC Ganguly, UT Yadav",6,2,0,0,0,0,0,8
"KM Jadhav, DT Christian",4,6,0,0,1,0,0,11
"M Manhas, YA Abdulla",1,2,1,0,1,0,0,5
"SS Tiwary, Shoaib Malik",2,1,0,0,1,0,0,4
"JP Duminy, GB Hogg",0,3,0,0,0,0,0,3
"S Badrinath, DR Smith",4,0,1,0,1,0,0,6
"CH Gayle, DL Vettori",0,1,0,0,0,0,0,1
"Bipul Sharma, NM Coulter-Nile",1,1,0,0,0,0,0,2
"CA Lynn, JJ Bumrah",7,4,4,0,0,0,2,15
"MS Dhoni, KV Sharma",15,9,0,0,1,4,0,29
"MM Sharma, SR Watson",0,2,0,0,1,0,0,3
"A Symonds, UT Yadav",5,5,0,0,2,0,0,12
"KA Pollard, Mohammed Siraj",2,1,0,0,0,0,0,3
"AT Rayudu, CL White",1,3,0,0,0,0,0,4
"G Gambhir, UT Yadav",6,7,1,0,4,1,0,19
"ML Hayden, RJ Harris",11,5,0,0,3,0,1,19
"KP Pietersen, LJ Wright",2,3,0,0,0,0,0,5
"AC Gilchrist, B Akhil",4,2,2,0,2,2,1,12
"MD Mishra, JR Hopes",1,3,0,0,0,0,0,4
"RR Pant, TS Mills",1,5,1,0,2,1,0,10
"DJ Hooda, S Gopal",0,1,0,0,0,2,0,3
"BJ Hodge, Y Nagar",1,2,0,0,1,1,0,5
"CJ Anderson, DS Kulkarni",4,4,0,0,0,2,0,10
"RA Jadeja, P Kumar",4,4,0,0,0,0,0,8
"Ankit Sharma, S Gopal",2,0,2,0,0,0,1,4
"AB de Villiers, Anand Rajan",1,3,0,0,2,1,0,7
"SV Samson, S Kaushik",1,3,0,0,0,0,0,4
"MV Boucher, CH Gayle",1,1,2,0,2,0,0,6
"BB McCullum, R Vinay Kumar",14,10,5,0,12,2,1,43
"GH Vihari, STR Binny",0,1,1,0,0,0,0,2
"A Mithun, R Ashwin",0,2,0,0,0,0,0,2
"RG Sharma, P Negi",5,17,2,0,4,0,0,28
"Q de Kock, S Kaushik",3,3,0,0,0,0,1,6
"PP Chawla, CH Gayle",1,3,0,0,0,0,1,4
"V Kohli, Basil Thampi",10,4,1,0,1,1,1,17
"R Sharma, S Narwal",2,0,2,0,0,1,1,5
"S Sohal, AB Agarkar",1,0,0,0,0,0,1,1
"KP Pietersen, S Gopal",2,4,1,0,0,0,0,7
"AM Rahane, M Morkel",32,18,5,2,9,3,1,69
"M Vohra, SMSM Senanayake",0,2,0,0,0,0,0,2
"AM Rahane, J Yadav",6,6,0,0,1,0,0,13
"JP Duminy, RE van der Merwe",1,3,0,0,0,1,0,5
"AM Rahane, JE Taylor",0,2,0,0,2,0,0,4
"A Ashish Reddy, BW Hilfenhaus",1,0,1,0,0,0,1,2
"DJG Sammy, P Negi",1,0,0,0,0,0,0,1
"AD Mathews, TL Suman",0,2,0,0,0,1,0,3
"IK Pathan, R Sharma",0,3,0,0,0,0,0,3
"DR Smith, RA Jadeja",10,5,3,0,0,2,1,20
"JJ Bumrah, MA Starc",0,1,0,0,0,0,0,1
"CL White, AC Thomas",3,2,0,0,2,0,0,7
"M Rawat, RR Raje",1,1,0,0,0,0,0,2
"R Ashwin, SMSM Senanayake",5,1,0,0,1,0,0,7
"R Sathish, JH Kallis",1,1,2,0,1,0,0,5
"V Kohli, SK Trivedi",13,11,4,0,2,1,2,31
"DR Smith, Karanveer Singh",6,0,1,0,3,2,0,12
"Y Venugopal Rao, PJ Sangwan",1,2,2,0,0,0,0,5
"BJ Hodge, KP Appanna",0,1,0,0,0,0,0,1
"DB Ravi Teja, B Lee",3,1,1,0,0,0,1,5
"NV Ojha, JA Morkel",19,10,0,0,10,3,2,42
"G Gambhir, MM Patel",19,9,0,0,7,1,2,36
"JH Kallis, VY Mahesh",9,9,1,0,3,0,0,22
"SK Warne, YA Abdulla",4,3,0,0,1,0,0,8
"RG Sharma, BW Hilfenhaus",5,4,1,0,2,2,1,14
"S Dhawan, Imran Tahir",1,0,0,0,0,0,1,1
"JO Holder, SB Jakati",0,1,0,0,0,0,0,1
"JC Buttler, MM Sharma",4,0,0,0,5,0,2,9
"T Taibu, R Vinay Kumar",1,0,1,0,0,0,0,2
"F du Plessis, P Kumar",12,11,1,0,3,1,0,28
"BB McCullum, AA Noffke",3,6,1,0,1,2,0,13
"YK Pathan, M Ashwin",7,4,1,0,2,3,0,17
"CH Morris, Iqbal Abdulla",1,3,0,0,1,0,1,5
"M Vijay, S Kaushik",4,5,0,0,1,0,1,10
"Yuvraj Singh, MG Johnson",5,6,1,0,3,0,0,15
"Q de Kock, KH Pandya",5,1,0,0,0,0,1,6
"R Bhatia, HV Patel",0,2,0,0,1,1,0,4
"JP Duminy, D Wiese",2,6,2,0,0,0,1,10
"AM Rahane, SP Narine",15,18,2,0,5,0,3,40
"MS Bisla, KV Sharma",1,1,0,0,0,0,1,2
"BJ Hodge, DE Bollinger",3,5,1,0,1,0,0,10
"S Dhawan, MM Patel",17,8,2,0,4,2,0,33
"AT Rayudu, TA Boult",1,3,0,0,1,1,0,6
"GC Smith, YA Abdulla",1,2,1,0,4,0,0,8
"LRPL Taylor, IK Pathan",0,1,0,0,1,0,0,2
"S Sreesanth, SL Malinga",5,1,0,0,0,0,0,6
"AM Rahane, Mohammed Shami",10,9,2,0,8,2,0,31
"CL White, SC Ganguly",4,8,1,0,1,3,0,17
"S Dhawan, A Choudhary",2,3,0,0,0,0,0,5
"KA Pollard, S Nadeem",7,7,2,0,1,0,1,17
"Y Venugopal Rao, CRD Fernando",6,3,2,0,0,1,0,12
"EJG Morgan, SK Raina",6,3,0,0,0,0,1,9
"AB de Villiers, WPUJC Vaas",4,4,0,0,1,0,0,9
"RP Singh, IK Pathan",2,2,0,0,0,0,1,4
"SK Raina, PV Tambe",7,2,1,0,0,0,0,10
"SA Yadav, KJ Abbott",0,1,0,0,0,0,0,1
"CH Gayle, DJ Bravo",15,19,1,0,2,4,2,41
"AM Rahane, PP Chawla",16,27,5,1,11,2,1,62
"CA Pujara, UT Yadav",3,1,1,0,1,0,0,6
"Mandeep Singh, M Morkel",6,2,0,0,4,0,1,12
"KC Sangakkara, HV Patel",1,4,0,0,0,0,0,5
"DB Ravi Teja, B Kumar",1,5,0,0,1,0,0,7
"X Thalaivan Sargunam, JO Holder",1,3,0,0,0,0,0,4
"JC Buttler, CR Woakes",4,2,1,0,0,1,0,8
"G Gambhir, BCJ Cutting",6,3,1,0,1,0,1,11
"KA Pollard, Joginder Sharma",1,1,0,0,1,0,0,3
"S Rana, IK Pathan",1,0,0,0,1,0,0,2
"MS Dhoni, VR Aaron",2,3,1,0,2,0,1,8
"DA Warner, DJG Sammy",3,3,0,0,0,0,0,6
"Q de Kock, S Aravind",7,12,1,0,5,1,0,26
"AJ Finch, JO Holder",4,2,0,0,0,0,0,6
"KA Pollard, MM Patel",2,3,1,0,0,1,0,7
"Misbah-ul-Haq, MF Maharoof",2,4,0,0,0,0,0,6
"JH Kallis, AL Menaria",3,3,1,0,1,1,0,9
"Bipul Sharma, L Balaji",1,3,3,0,0,0,0,7
"LMP Simmons, HV Patel",4,6,1,0,0,1,0,12
"EJG Morgan, MA Starc",2,1,1,0,0,1,1,5
"SR Tendulkar, A Uniyal",3,2,0,0,1,0,0,6
"S Dhawan, SM Pollock",7,0,0,0,0,1,1,8
"AL Menaria, P Awana",7,5,2,0,0,0,0,14
"KH Pandya, R Bhatia",1,2,0,0,0,0,1,3
"EJG Morgan, RR Powar",3,3,0,0,0,0,0,6
"SD Chitnis, JA Morkel",0,1,0,0,0,0,0,1
"KA Pollard, SK Trivedi",9,10,0,0,0,0,0,19
"MA Agarwal, Harbhajan Singh",8,3,0,0,3,2,0,16
"KD Karthik, JD Unadkat",6,9,1,0,3,1,0,20
"KA Pollard, GB Hogg",1,5,0,0,2,0,0,8
"SV Samson, L Balaji",4,2,0,0,1,1,0,8
"M Kartik, AN Ahmed",0,2,0,0,1,0,0,3
"DJ Bravo, A Ashish Reddy",0,3,0,0,0,0,0,3
"BCJ Cutting, R Shukla",3,0,0,0,0,0,0,3
"MEK Hussey, MA Starc",6,7,2,0,2,0,0,17
"M Vijay, A Zampa",3,8,0,0,1,2,0,14
"Mandeep Singh, CH Morris",5,2,1,0,1,0,0,9
"LA Pomersbach, A Nehra",5,2,0,0,3,2,0,12
"BB McCullum, DW Steyn",9,4,1,0,1,1,2,16
"SA Yadav, NLTC Perera",5,4,0,0,3,0,1,12
"DA Miller, MJ McClenaghan",7,4,0,0,1,0,0,12
"Anirudh Singh, I Sharma",0,1,0,0,0,0,0,1
"MD Mishra, IK Pathan",2,2,0,0,1,0,0,5
"PA Patel, RE van der Merwe",6,5,2,0,0,0,0,13
"SPD Smith, M Morkel",0,4,1,0,2,0,0,7
"CH Morris, B Stanlake",0,1,0,0,0,0,0,1
"SA Yadav, B Kumar",6,2,2,0,2,1,1,13
"LA Pomersbach, IK Pathan",1,1,0,0,2,0,0,4
"SR Tendulkar, DE Bollinger",15,9,0,0,2,0,2,26
"STR Binny, P Kumar",7,6,0,0,0,0,1,13
"S Vidyut, Mohammad Asif",3,4,0,0,4,0,0,11
"IK Pathan, MS Gony",10,4,2,0,4,1,0,21
"GJ Maxwell, AD Russell",6,4,1,0,0,2,0,13
"K Goel, P Kumar",5,3,1,0,1,0,0,10
"TL Suman, SW Tait",2,0,0,0,0,0,1,2
"RV Uthappa, Anureet Singh",1,2,1,0,2,0,1,6
"DJG Sammy, BW Hilfenhaus",3,2,0,0,2,0,0,7
"NLTC Perera, PP Chawla",5,3,3,0,0,1,1,12
"GJ Bailey, BB Sran",2,3,0,0,1,0,0,6
"RP Singh, SK Warne",1,2,1,0,0,0,0,4
"T Henderson, LR Shukla",1,0,0,0,0,0,0,1
"TL Suman, I Sharma",11,5,0,0,1,0,0,17
"W Jaffer, MS Gony",3,2,1,0,2,0,0,8
"I Sharma, VRV Singh",1,0,0,0,0,0,0,1
"P Negi, DJ Bravo",0,1,0,0,0,0,0,1
"SS Tiwary, TA Boult",3,2,0,0,1,0,0,6
"RS Bopara, MM Patel",4,3,0,2,1,0,1,10
"K Goel, MM Patel",11,1,0,0,2,2,1,16
"PA Patel, JR Hopes",3,3,0,0,2,0,0,8
"R Dravid, M Morkel",8,11,2,0,3,0,1,24
"RV Uthappa, R McLaren",1,0,1,0,0,0,0,2
"RA Jadeja, AC Thomas",0,0,0,0,3,0,0,3
"RA Jadeja, I Sharma",8,5,1,0,2,0,2,16
"NLTC Perera, P Kumar",2,3,1,0,2,1,0,9
"LMP Simmons, P Negi",4,9,1,0,1,1,0,16
"N Saini, VR Aaron",4,2,0,1,1,0,0,8
"GJ Maxwell, BB Sran",3,0,0,0,1,0,0,4
"KL Rahul, MP Stoinis",0,3,0,0,3,1,0,7
"RA Jadeja, M Ashwin",3,2,0,0,0,0,0,5
"KM Jadhav, UT Yadav",3,2,0,0,0,0,1,5
"KM Jadhav, SP Narine",5,8,0,0,3,1,0,17
"Shakib Al Hasan, Parvez Rasool",0,1,0,0,0,0,0,1
"V Sehwag, JR Hopes",1,1,0,0,0,0,0,2
"SR Tendulkar, AB McDonald",2,4,0,0,0,0,0,6
"S Badrinath, ST Jayasuriya",1,0,0,0,0,0,0,1
"MC Juneja, SP Narine",0,1,0,0,0,0,0,1
"BMAJ Mendis, DJ Bravo",1,2,0,0,0,0,0,3
"RA Jadeja, UT Yadav",1,7,1,0,0,0,1,9
"MM Sharma, P Kumar",1,1,0,0,0,0,1,2
"JD Unadkat, R Ashwin",4,0,0,0,0,0,0,4
"KH Pandya, IK Pathan",0,2,1,0,0,1,0,4
"LR Shukla, PP Chawla",1,0,0,0,1,0,0,2
"SK Warne, SE Bond",4,0,0,0,0,0,1,4
"Q de Kock, R Vinay Kumar",1,2,0,0,3,1,0,7
"NV Ojha, AM Salvi",5,1,0,0,0,0,1,6
"SS Iyer, AD Russell",14,6,1,0,2,2,2,25
"WA Mota, RJ Harris",1,2,0,0,0,0,0,3
"AC Voges, AB Dinda",1,2,2,0,0,0,1,5
"SS Iyer, CH Morris",6,1,0,0,0,1,1,8
"AT Rayudu, Anand Rajan",3,3,0,0,0,0,0,6
"G Gambhir, RJ Harris",7,2,0,0,0,0,1,9
"KA Pollard, Z Khan",8,17,1,0,5,1,1,32
"V Sehwag, SL Malinga",19,13,0,0,7,0,1,39
"DPMD Jayawardene, SB Bangar",2,3,0,0,0,0,0,5
"G Gambhir, A Nehra",14,11,1,0,2,1,1,29
"MS Dhoni, I Sharma",5,7,2,0,4,0,0,18
"AJ Finch, SB Wagh",2,1,1,0,0,2,0,6
"Sachin Baby, M Morkel",0,1,0,0,0,0,0,1
"SR Tendulkar, HV Patel",3,2,1,0,1,0,1,7
"M Vijay, M de Lange",5,1,0,0,3,1,0,10
"G Gambhir, ST Jayasuriya",1,2,0,0,0,0,0,3
"DJ Hussey, V Pratap Singh",3,3,0,0,1,0,1,7
"RA Jadeja, A Mishra",16,16,4,0,0,1,4,37
"TR Birt, PP Chawla",3,0,0,0,1,0,0,4
"EJG Morgan, MJ McClenaghan",9,2,1,0,0,0,1,12
"PP Chawla, Imran Tahir",2,1,2,0,0,0,0,5
"MM Sharma, YS Chahal",1,1,0,0,1,0,0,3
"AD Mathews, A Ashish Reddy",0,3,0,0,0,0,0,3
"DT Christian, S Aravind",2,1,0,0,0,0,1,3
"DW Steyn, Iqbal Abdulla",0,0,1,0,0,0,0,1
"AA Jhunjhunwala, A Kumble",4,3,0,0,0,0,0,7
"WP Saha, TA Boult",5,2,0,0,2,0,1,9
"NV Ojha, Harmeet Singh",4,3,0,0,2,0,0,9
"CR Brathwaite, MP Stoinis",1,0,1,0,0,0,0,2
"W Jaffer, RP Singh",4,4,0,0,2,0,0,10
"LMP Simmons, I Sharma",5,1,1,0,3,0,1,10
"SB Styris, L Balaji",2,1,0,0,1,0,0,4
"DJ Bravo, M Kartik",8,4,0,0,2,1,1,15
"NLTC Perera, AB Dinda",2,1,0,0,0,0,1,3
"R Dravid, R Ashwin",4,10,1,0,3,0,0,18
"Shakib Al Hasan, P Kumar",0,2,0,0,2,0,0,4
"AD Russell, Ankit Sharma",3,1,0,0,0,2,0,6
"AT Rayudu, MC Henriques",16,10,0,0,3,1,1,30
"FY Fazal, MF Maharoof",2,0,0,0,0,0,1,2
"JP Faulkner, VR Aaron",0,1,1,0,1,2,0,5
"STR Binny, MC Henriques",2,2,1,0,0,0,0,5
"S Badrinath, M Kartik",13,20,7,0,6,1,0,47
"Iqbal Abdulla, M Muralitharan",2,1,0,0,0,0,0,3
"DPMD Jayawardene, A Kumble",3,5,2,0,2,1,0,13
"N Rana, AS Rajpoot",5,1,0,0,1,1,1,8
"S Vidyut, VY Mahesh",4,3,1,1,2,1,0,12
"YK Pathan, LR Shukla",6,5,4,0,1,1,0,17
"MS Dhoni, SK Trivedi",14,10,5,0,3,1,1,33
"ST Jayasuriya, S Sreesanth",8,1,1,0,0,0,1,10
"SE Marsh, MS Gony",3,5,0,0,1,0,0,9
"RR Pant, TM Head",1,4,1,0,0,1,0,7
"G Gambhir, Harbhajan Singh",29,34,6,0,8,1,4,78
"LJ Wright, S Kaul",1,1,0,0,0,0,1,2
"GD McGrath, DS Kulkarni",2,0,0,0,0,0,1,2
"R Dravid, AB Dinda",9,7,1,0,4,0,0,21
"F du Plessis, CJ Anderson",2,3,3,0,4,2,0,14
"WD Parnell, L Balaji",1,2,0,0,0,0,1,3
"SK Raina, B Lee",7,3,2,0,0,2,0,14
"KC Sangakkara, Yuvraj Singh",1,3,1,0,0,0,0,5
"DA Warner, MA Starc",10,9,4,0,2,0,1,25
"SK Trivedi, DJ Bravo",2,0,0,0,0,0,1,2
"Gurkeerat Singh, SW Tait",3,0,0,0,0,0,0,3
"AB Agarkar, R Bhatia",1,3,1,0,1,1,0,7
"G Gambhir, RA Shaikh",1,1,0,0,1,0,0,3
"SP Goswami, AC Thomas",1,0,1,0,1,0,1,3
"SE Marsh, AJ Tye",1,0,0,0,0,0,1,1
"Yuvraj Singh, DL Vettori",7,8,0,0,2,2,0,19
"SK Warne, L Balaji",6,6,0,0,0,0,1,12
"YS Chahal, LH Ferguson",4,1,0,0,0,0,0,5
"RR Pant, Imran Tahir",1,4,1,0,0,0,0,6
"TL Suman, SK Trivedi",3,6,1,0,2,0,1,12
"S Dhawan, DJ Muthuswami",4,0,0,0,0,0,0,4
"SK Raina, JD Ryder",0,2,0,0,0,0,0,2
"M Kartik, AB McDonald",1,1,0,0,0,0,0,2
"JP Faulkner, Iqbal Abdulla",1,0,0,0,0,0,1,1
"SR Watson, A Kumble",12,13,2,0,7,0,0,34
"RA Jadeja, A Mithun",1,2,0,0,0,0,1,3
"BJ Hodge, SK Trivedi",5,5,0,0,1,0,0,11
"MEK Hussey, BW Hilfenhaus",2,0,0,0,0,0,1,2
"MS Dhoni, AD Russell",7,4,0,0,1,1,1,13
"SS Tiwary, A Mishra",11,14,3,0,2,3,1,33
"KP Pietersen, SR Watson",8,4,1,0,3,0,1,16
"CL White, M Morkel",4,8,1,0,1,0,0,14
"R Vinay Kumar, R Ashwin",1,2,0,0,0,0,0,3
"SW Tait, R Vinay Kumar",1,1,0,0,0,0,0,2
"JP Faulkner, S Kaul",2,1,0,0,0,0,0,3
"SP Narine, Anureet Singh",1,0,0,0,0,0,0,1
"CH Gayle, LR Shukla",3,0,0,0,1,0,1,4
"Shakib Al Hasan, R Vinay Kumar",2,1,1,0,0,0,2,4
"AT Rayudu, AB McDonald",0,2,1,0,1,0,0,4
"AD Mathews, J Botha",2,8,2,0,1,0,0,13
"MA Agarwal, B Lee",2,4,0,0,1,0,0,7
"NV Ojha, KA Pollard",6,6,1,0,0,1,0,14
"M Vohra, SL Malinga",2,1,0,0,2,1,0,6
"J Botha, M Morkel",6,4,1,0,0,0,0,11
"DH Yagnik, DJ Bravo",2,1,0,0,2,0,0,5
"CJ Anderson, MG Johnson",8,1,1,0,0,0,0,10
"SK Warne, Y Venugopal Rao",1,3,0,0,0,2,0,6
"JA Morkel, SK Warne",12,9,4,0,6,8,0,39
"A Symonds, PP Ojha",5,3,0,0,0,0,0,8
"CA Lynn, A Chandila",2,1,0,0,0,0,0,3
"KM Jadhav, J Suchith",4,2,1,0,0,1,0,8
"P Kumar, SC Ganguly",8,1,0,0,0,1,0,10
"AR Patel, DJ Hooda",0,2,0,0,0,0,0,2
"BJ Hodge, P Negi",1,0,0,0,0,0,1,1
"KD Karthik, MK Tiwary",2,1,0,0,1,0,0,4
"IK Pathan, RE van der Merwe",2,1,1,0,1,0,0,5
"M Manhas, A Ashish Reddy",1,4,0,0,0,0,0,5
"JA Morkel, RE van der Merwe",3,4,0,0,0,0,0,7
"RV Uthappa, JA Morkel",14,9,3,1,3,2,2,32
"M Vijay, SA Yadav",2,1,1,0,0,0,0,4
"J Botha, Anureet Singh",1,0,0,0,0,0,0,1
"Bipul Sharma, MN Samuels",1,4,0,0,1,1,0,7
"AB de Villiers, SL Malinga",17,12,8,0,9,2,0,48
"Harbhajan Singh, JP Faulkner",3,5,0,0,0,0,0,8
"Yuvraj Singh, P Kumar",14,11,0,0,1,1,1,27
"AP Tare, JP Duminy",0,1,0,0,0,0,0,1
"SK Raina, VRV Singh",8,6,0,0,1,3,0,18
"HH Pandya, Rashid Khan",6,2,1,0,0,0,1,9
"DJ Jacobs, Bipul Sharma",1,0,0,0,0,0,1,1
"Yuvraj Singh, R Vinay Kumar",5,3,0,0,1,0,1,9
"KA Pollard, STR Binny",1,5,1,0,1,1,1,9
"JH Kallis, BJ Hodge",1,4,0,0,0,0,0,5
"SA Yadav, JP Faulkner",5,4,0,0,0,0,1,9
"SB Styris, Z Khan",1,0,0,0,0,0,1,1
"MS Dhoni, V Sehwag",5,4,0,0,1,1,0,11
"VY Mahesh, SR Watson",1,0,0,0,0,0,0,1
"WP Saha, JDP Oram",2,0,0,0,0,0,0,2
"MK Pandey, PJ Cummins",2,5,1,0,1,0,0,9
"M Kartik, A Nehra",0,2,1,0,0,0,0,3
"RN ten Doeschate, MA Starc",2,0,0,0,0,0,1,2
"DPMD Jayawardene, M Morkel",4,1,0,0,0,0,0,5
"MK Tiwary, WD Parnell",2,10,4,0,2,0,0,19
"SE Marsh, KV Sharma",1,2,1,0,0,0,0,4
"JH Kallis, Mohammad Asif",2,3,0,0,3,0,0,8
"MK Tiwary, AC Thomas",2,1,0,0,0,1,0,5
"MS Wade, JP Faulkner",1,1,0,0,0,0,0,2
"M Kaif, J Botha",4,3,0,0,0,0,1,7
"AM Nayar, JP Duminy",1,2,0,0,0,0,0,3
"CJ Anderson, L Balaji",1,2,0,0,0,0,0,3
"V Kohli, SMSM Senanayake",2,0,0,0,0,0,0,2
"J Suchith, TA Boult",0,1,1,0,0,0,0,2
"V Sehwag, R Shukla",2,3,1,0,1,0,0,7
"Y Venugopal Rao, M Morkel",2,1,0,0,3,0,0,6
"WP Saha, A Mishra",8,12,1,0,3,0,2,24
"IK Pathan, AD Mascarenhas",0,2,0,0,0,0,0,2
"AG Paunikar, B Lee",7,3,0,0,1,0,0,11
"JP Faulkner, I Sharma",0,2,0,0,0,2,0,4
"Mohammad Asif, RA Jadeja",1,0,0,0,0,0,0,1
"BB McCullum, AR Patel",19,15,1,0,3,1,2,39
"A Symonds, RR Powar",5,1,2,0,1,0,0,9
"AM Rahane, A Mithun",4,4,1,0,1,1,0,11
"AT Rayudu, SP Narine",14,10,2,0,3,0,1,29
"SR Watson, S Tyagi",3,1,1,0,1,0,0,6
"KK Nair, BE Hendricks",1,0,0,1,1,0,0,3
"S Dhawan, DE Bollinger",9,5,0,0,3,0,1,17
"RA Jadeja, M Muralitharan",10,7,3,0,2,1,0,23
"AB de Villiers, T Natarajan",1,1,0,0,0,0,0,2
"CR Brathwaite, SR Watson",2,1,0,0,0,0,0,3
"DA Warner, TA Boult",5,2,0,0,3,0,0,10
"SD Chitnis, BW Hilfenhaus",1,0,0,0,0,0,1,1
"WP Saha, P Amarnath",3,0,0,0,3,0,0,6
"F du Plessis, BE Hendricks",1,1,0,2,1,0,0,5
"AT Rayudu, M Ashwin",2,5,0,0,0,0,0,7
"MV Boucher, SK Warne",5,1,1,0,0,0,1,7
"B Akhil, Joginder Sharma",1,1,0,0,0,0,0,2
"SR Tendulkar, DT Christian",9,10,1,0,2,0,0,22
"JR Hopes, J Syed Mohammad",1,3,1,0,2,0,0,7
"CK Kapugedera, Mohammad Asif",1,3,0,0,0,0,0,4
"Shakib Al Hasan, Karanveer Singh",3,3,0,0,1,0,1,7
"SD Chitnis, VR Aaron",7,3,1,0,2,0,0,13
"Y Venugopal Rao, Azhar Mahmood",4,2,0,0,0,0,0,6
"RV Uthappa, GJ Maxwell",1,3,0,0,1,0,0,5
"MS Bisla, J Botha",1,2,0,0,0,0,0,3
"LR Shukla, P Amarnath",0,3,0,0,0,0,0,3
"DM Bravo, SN Thakur",0,0,0,0,1,0,0,1
"KH Pandya, MC Henriques",1,2,0,0,0,0,0,3
"UBT Chand, JO Holder",1,1,0,0,0,0,0,2
"GJ Maxwell, M de Lange",0,1,0,0,0,0,0,1
"SA Yadav, Mustafizur Rahman",1,1,0,0,1,0,0,3
"KP Pietersen, KW Richardson",1,0,0,0,0,0,1,1
"HM Amla, AJ Tye",4,1,0,0,3,1,0,9
"CA Pujara, JH Kallis",5,2,0,0,0,2,1,9
"S Sriram, PC Valthaty",2,2,1,0,0,0,0,5
"DA Warner, R Ashwin",17,26,4,0,2,1,1,50
"M Kaif, Iqbal Abdulla",1,1,2,0,0,0,0,4
"SC Ganguly, SP Narine",10,3,0,0,1,0,0,14
"HH Pandya, MC Henriques",3,5,0,0,0,0,0,8
"MD Mishra, Z Khan",4,1,0,0,1,0,1,6
"RG Sharma, I Sharma",10,7,0,1,3,1,2,22
"WP Saha, MM Sharma",5,1,0,0,0,1,1,7
"S Nadeem, JJ Bumrah",3,1,0,0,0,0,0,4
"SA Yadav, R Ashwin",6,8,0,0,0,2,0,16
"KC Sangakkara, TL Suman",8,10,3,0,1,0,0,22
"Yuvraj Singh, Azhar Mahmood",1,0,0,0,0,0,1,1
"Yuvraj Singh, NLTC Perera",1,3,0,0,1,1,0,6
"MJ Guptill, JJ Bumrah",1,4,0,0,1,0,0,6
"NLTC Perera, MN Samuels",1,2,2,0,1,1,0,7
"S Dhawan, MM Sharma",24,18,4,0,9,0,3,55
"JR Hopes, Joginder Sharma",0,2,0,0,2,0,0,4
"MC Henriques, AR Patel",6,10,2,0,2,0,1,20
"RN ten Doeschate, Karanveer Singh",1,1,0,0,0,2,1,4
"UT Khawaja, A Mishra",5,1,0,0,0,0,1,6
"PA Patel, VY Mahesh",3,1,0,0,2,0,0,6
"YK Pathan, JP Faulkner",3,6,0,0,1,1,0,11
"GJ Maxwell, SR Watson",3,1,0,0,1,0,1,5
"P Kumar, T Henderson",1,1,0,0,0,0,0,2
"KD Karthik, A Singh",0,1,0,0,0,0,0,1
"KM Jadhav, BW Hilfenhaus",3,1,0,0,1,0,0,5
"CM Gautam, AB Dinda",8,4,0,0,1,1,0,14
"R McLaren, JP Duminy",1,2,0,0,0,0,0,3
"Azhar Mahmood, DL Vettori",0,4,0,0,0,0,0,4
