key,0s,1s,2s,3s,4s,6s,outs,balls
"DA Miller, AB McDonald",2,6,0,0,0,0,1,8
"SK Raina, S Ladda",1,1,0,0,1,0,0,3
"KA Pollard, DJ Hussey",1,1,1,0,0,0,0,3
"AD Russell, BB Sran",2,1,0,0,1,1,0,5
"B Chipli, UT Yadav",0,1,0,0,0,0,0,1
"PP Chawla, DR Smith",4,1,1,0,0,0,1,6
"AJ Finch, Iqbal Abdulla",5,2,0,0,1,0,1,8
"SK Raina, MK Tiwary",0,2,0,0,0,1,0,3
"DA Warner, S Kaushik",1,10,1,0,1,1,0,14
"JDS Neesham, MG Johnson",2,1,0,0,1,0,0,4
"NV Ojha, KK Cooper",2,2,0,0,0,0,0,4
"NV Ojha, S Sreesanth",16,8,0,1,3,0,2,28
"CL White, RJ Harris",5,8,4,0,2,3,0,22
"DT Christian, J Botha",2,6,0,1,1,1,0,11
"SD Chitnis, DS Kulkarni",2,1,0,0,0,0,0,3
"Q de Kock, YS Chahal",5,8,0,0,2,1,2,16
"DA Warner, P Awana",5,2,0,0,2,3,0,12
"SW Billings, CR Woakes",0,3,0,0,0,0,0,3
"JA Morkel, Y Venugopal Rao",1,1,0,0,0,1,1,3
"DB Ravi Teja, SB Wagh",4,0,0,0,2,0,0,6
"DB Das, KA Pollard",1,2,0,0,1,0,0,4
"JR Hopes, R Vinay Kumar",2,0,0,0,0,0,1,2
"STR Binny, NM Coulter-Nile",4,0,0,0,1,0,0,5
"GJ Maxwell, SP Narine",15,14,2,0,3,0,2,34
"DB Das, MS Gony",4,2,0,0,0,0,0,6
"RV Uthappa, Iqbal Abdulla",13,7,3,1,2,0,3,26
"MS Dhoni, ST Jayasuriya",2,6,0,0,0,1,0,9
"Vishnu Vinod, MM Sharma",1,1,0,0,1,0,0,3
"DW Steyn, R Vinay Kumar",2,3,1,0,2,0,0,8
"KK Nair, SP Narine",15,7,0,0,4,0,1,26
"R Vinay Kumar, MG Johnson",3,1,0,0,1,0,0,5
"DJ Hussey, NLTC Perera",3,5,0,0,1,0,0,9
"B Akhil, M Morkel",2,2,0,0,0,0,1,4
"KM Jadhav, DE Bollinger",0,1,0,0,0,0,0,1
"NM Coulter-Nile, PP Chawla",5,2,0,0,0,0,0,7
"F du Plessis, AR Patel",10,12,3,0,3,1,0,29
"AM Rahane, L Balaji",8,3,1,0,1,0,1,13
"BB McCullum, SW Tait",3,1,0,0,1,1,0,6
"AD Mathews, HH Pandya",2,1,0,0,0,1,1,4
"AL Menaria, L Balaji",2,0,0,0,0,0,1,2
"A Mithun, RJ Harris",2,2,0,0,1,1,1,6
"YV Takawale, VY Mahesh",1,0,0,0,0,0,1,1
"A Mithun, DL Vettori",1,1,0,0,1,0,0,3
"SPD Smith, PP Chawla",6,13,5,0,0,0,1,24
"AM Rahane, Parvez Rasool",0,4,0,0,1,0,0,5
"MJ Lumb, R Sharma",3,5,1,0,0,0,0,9
"RV Uthappa, R Tewatia",3,5,0,0,0,1,1,9
"MR Marsh, A Nehra",2,1,1,0,0,0,1,4
"SA Yadav, JJ Bumrah",4,5,0,0,1,3,1,13
"R Dravid, Shahid Afridi",3,4,0,0,0,0,0,7
"AC Voges, IK Pathan",1,4,2,1,2,1,0,11
"CM Gautam, SR Watson",1,0,0,0,0,0,1,1
"PA Reddy, MS Gony",3,0,0,0,1,0,1,4
"Shoaib Malik, S Sreesanth",0,2,0,0,1,0,0,3
"F du Plessis, Ankit Sharma",13,9,2,1,2,1,1,28
"Yuvraj Singh, J Syed Mohammad",0,2,0,0,1,2,0,5
"AM Rahane, R Dhawan",11,4,1,0,2,0,1,18
"LR Shukla, SB Styris",3,1,0,0,0,1,0,5
"Yashpal Singh, RA Jadeja",2,1,0,0,1,0,0,4
"Mandeep Singh, R Rampaul",3,2,0,0,1,0,0,6
"JP Duminy, PJ Sangwan",1,0,0,0,0,0,0,1
"AD Russell, Mustafizur Rahman",1,1,0,0,0,0,1,2
"Harbhajan Singh, MN Samuels",1,2,0,0,1,0,0,4
"JP Faulkner, MM Sharma",3,4,3,0,1,0,1,11
"TR Birt, YK Pathan",3,2,0,0,0,0,1,5
"NJ Maddinson, Harbhajan Singh",0,0,0,1,0,0,0,1
"SS Iyer, KA Pollard",1,4,0,0,0,0,0,5
"SR Watson, J Suchith",9,1,0,0,1,1,1,12
"HV Patel, IK Pathan",1,1,0,0,0,0,0,2
"P Parameswaran, A Mithun",0,1,0,0,0,0,0,1
"DR Smith, JP Duminy",2,5,0,0,0,0,0,7
"RV Uthappa, Rashid Khan",4,9,0,0,3,3,0,19
"SR Watson, R Bhatia",1,5,0,0,0,2,0,8
"RV Uthappa, ST Jayasuriya",2,2,1,0,2,1,0,8
"SE Marsh, SB Wagh",5,1,0,0,1,0,1,7
"JH Kallis, GD McGrath",7,6,0,0,1,0,0,14
"KK Nair, DL Chahar",1,0,1,0,1,0,0,3
"DT Christian, BJ Hodge",0,1,0,0,0,0,0,1
"SP Narine, SN Thakur",2,1,0,0,2,0,0,5
"VVS Laxman, CK Langeveldt",2,2,0,0,1,0,0,5
"AD Nath, VR Aaron",0,1,0,0,0,0,0,1
"RG Sharma, A Ashish Reddy",3,1,0,0,1,0,0,5
"SE Marsh, JJ van der Wath",5,1,0,0,4,3,0,13
"RV Uthappa, A Nehra",14,10,2,1,8,1,2,36
"I Sharma, A Singh",0,1,0,0,0,0,0,1
"SN Khan, MM Sharma",1,2,0,0,1,0,0,4
"Mohammad Ashraful, DP Nannes",4,0,0,0,0,0,0,4
"JH Kallis, SR Watson",10,9,2,1,4,0,0,26
"DA Miller, YS Chahal",7,11,1,0,1,3,3,23
"MR Marsh, Harbhajan Singh",1,2,0,0,0,1,0,4
"AP Tare, IK Pathan",1,0,0,0,1,0,0,2
"AB de Villiers, Shoaib Ahmed",5,0,0,0,1,0,1,6
"DJ Hussey, SM Pollock",3,1,0,0,2,0,1,6
"KD Karthik, B Lee",3,6,0,0,1,0,0,10
"Yuvraj Singh, A Singh",2,1,0,0,0,0,1,3
"JA Morkel, DW Steyn",7,5,0,0,1,0,2,13
"R Rampaul, KA Pollard",1,3,1,0,1,0,0,6
"TR Birt, RJ Harris",1,0,1,0,1,0,0,3
"IK Pathan, AR Patel",3,2,0,0,0,0,1,5
"TM Head, SL Malinga",1,1,0,0,0,0,0,2
"SE Marsh, Yuvraj Singh",1,2,1,0,0,1,0,5
"SR Tendulkar, I Sharma",37,12,5,1,13,1,1,69
"Anirudh Singh, KP Pietersen",1,1,0,0,1,0,0,3
"GJ Maxwell, M Muralitharan",2,1,1,0,0,0,1,4
"YK Pathan, KV Sharma",8,10,2,0,1,7,1,28
"SM Katich, A Symonds",5,1,0,0,0,0,1,6
"JH Kallis, JA Morkel",23,23,1,0,10,0,2,57
"SR Watson, CH Gayle",3,1,1,0,0,0,0,5
"SR Watson, CRD Fernando",5,1,0,0,0,0,0,6
"NLTC Perera, Azhar Mahmood",3,2,0,0,0,3,0,8
"MS Dhoni, AB Agarkar",11,12,2,0,6,1,0,32
"BJ Hodge, AC Thomas",2,1,0,0,0,0,0,3
"Z Khan, SL Malinga",1,1,0,0,0,0,0,2
"TL Suman, RA Jadeja",3,4,0,0,0,0,0,7
"YK Pathan, UT Yadav",11,9,0,0,3,0,2,23
"S Badrinath, AB Dinda",2,5,1,0,0,0,0,8
"SL Malinga, SP Narine",1,1,0,0,0,1,0,3
"WP Saha, JD Unadkat",4,2,0,1,0,1,0,8
"MJ Lumb, SL Malinga",2,0,0,0,0,0,1,2
"Yuvraj Singh, MM Sharma",6,11,2,0,4,2,1,25
"CH Gayle, SJ Srivastava",10,0,0,0,2,0,1,12
"AP Majumdar, R Bhatia",2,3,1,0,0,0,0,6
"MS Gony, SB Bangar",0,1,1,0,0,2,0,4
"SB Styris, M Kartik",1,1,0,0,1,0,0,3
"BB McCullum, Yuvraj Singh",1,2,1,0,1,0,0,5
"NV Ojha, HV Patel",1,3,1,0,1,0,0,6
"PP Ojha, M Morkel",3,1,0,0,0,0,0,4
"YK Pathan, TG Southee",0,1,0,0,2,0,0,3
"CL White, AN Ahmed",3,1,0,0,0,0,0,4
"RA Jadeja, MS Gony",4,4,0,0,1,0,0,9
"S Dhawan, PJ Cummins",1,6,1,0,2,0,0,10
"T Kohli, JA Morkel",0,2,0,0,0,0,0,2
"Shahid Afridi, DJ Bravo",1,0,0,0,0,0,1,1
"VVS Laxman, S Narwal",3,2,0,0,0,0,0,5
"MS Bisla, AD Mascarenhas",1,2,2,0,1,1,0,7
"RA Jadeja, MM Patel",1,1,1,0,2,0,1,5
"JH Kallis, SR Tendulkar",0,3,0,0,0,0,0,3
"DJ Hussey, B Kumar",2,4,0,0,0,0,1,6
"M Vohra, Rashid Khan",5,3,0,0,4,3,0,15
"KB Arun Karthik, M Morkel",1,2,1,0,0,0,0,4
"Mandeep Singh, Sandeep Sharma",11,4,1,0,1,0,0,17
"CRD Fernando, DE Bollinger",0,2,0,0,0,0,0,2
"AT Rayudu, A Mishra",16,32,9,0,3,2,3,62
"DJ Bravo, A Kumble",1,3,1,0,0,0,0,5
"HH Pandya, MG Johnson",0,0,0,0,1,0,0,1
"NM Coulter-Nile, IC Pandey",1,0,0,0,1,0,0,2
"Ishan Kishan, S Nadeem",1,1,0,0,0,0,0,2
"A Flintoff, DJ Bravo",4,0,0,1,1,1,0,7
"BJ Hodge, CH Gayle",4,2,0,0,0,0,0,6
"KK Cooper, AR Patel",1,0,1,0,0,0,1,2
"CJ Anderson, PP Chawla",6,4,1,0,3,1,0,15
"CJ Ferguson, Iqbal Abdulla",5,2,0,0,0,0,0,7
"R Dravid, YK Pathan",10,4,3,0,1,4,1,22
"RA Jadeja, CH Gayle",7,9,0,0,1,0,0,17
"S Badrinath, RP Singh",8,9,0,0,2,0,2,19
"HH Pandya, NM Coulter-Nile",5,0,0,0,0,0,1,5
"Joginder Sharma, SB Styris",0,1,0,0,0,1,0,2
"KJ Abbott, UT Yadav",2,0,1,0,0,0,0,3
"F du Plessis, M Kartik",7,11,2,0,2,1,0,23
"MS Dhoni, AC Voges",0,2,0,0,0,0,0,2
"RE Levi, A Singh",2,3,0,0,0,0,0,5
"RS Bopara, Z Khan",4,6,0,0,0,0,1,10
"JP Duminy, Y Venugopal Rao",0,7,0,0,0,0,0,7
"MN Samuels, SL Malinga",1,0,1,0,0,0,1,2
"DJ Hussey, S Sreesanth",6,7,0,0,3,1,0,17
"JH Kallis, P Amarnath",1,2,0,0,1,0,0,4
"KL Rahul, BB Sran",1,3,0,0,1,1,0,6
"S Dhawan, L Balaji",13,20,0,0,3,3,0,39
"MJ Guptill, SL Malinga",0,1,1,0,0,1,0,3
"LRPL Taylor, RS Bopara",0,2,0,0,0,0,0,2
"IK Pathan, GJ Maxwell",1,2,0,0,0,0,0,3
"CH Morris, DR Smith",0,1,0,0,0,3,0,4
"VVS Laxman, AB Dinda",5,0,0,0,1,0,1,6
"RS Bopara, CH Morris",4,5,0,0,1,0,0,10
"TL Suman, R Vinay Kumar",4,6,4,0,1,1,1,16
"KC Sangakkara, MN Samuels",2,2,2,0,4,0,0,10
"S Dhawan, A Mishra",4,10,1,0,1,0,2,16
"G Gambhir, PJ Cummins",5,5,0,0,3,0,0,13
"CL White, DJ Bravo",4,6,0,0,5,0,0,15
"MS Dhoni, B Kumar",11,16,6,1,5,5,0,44
"RE van der Merwe, PP Ojha",4,2,0,1,2,1,1,10
"AR Patel, MC Henriques",4,6,2,0,0,2,1,14
"CL White, RR Powar",0,1,0,0,0,0,0,1
"RA Jadeja, SP Narine",14,7,4,0,0,3,1,28
"JP Duminy, Yuvraj Singh",5,19,1,0,2,2,0,29
"BB McCullum, M Ashwin",2,5,0,0,0,1,0,8
"KD Karthik, RR Raje",1,5,1,0,2,0,0,9
"SA Yadav, SK Raina",4,4,1,1,0,0,0,10
"LA Pomersbach, V Kohli",0,2,0,0,1,0,0,3
"PV Tambe, NLTC Perera",0,1,0,0,0,0,0,1
"RG Sharma, JW Hastings",4,4,0,0,3,0,0,11
"KD Karthik, KH Pandya",6,2,1,0,0,0,2,9
"N Rana, B Kumar",1,3,0,0,1,0,1,5
"SP Narine, Sandeep Sharma",7,3,0,0,3,1,0,14
"SPD Smith, JD Unadkat",3,5,1,0,2,0,0,11
"Harbhajan Singh, UT Yadav",5,3,0,0,1,0,1,9
"HM Amla, TA Boult",4,0,1,0,2,0,0,7
"CH Gayle, AD Mathews",9,8,0,0,2,0,1,19
"HH Pandya, DT Christian",2,2,1,0,0,0,1,5
"SS Tiwary, DW Steyn",1,3,0,0,0,1,0,5
"K Goel, DJ Hussey",4,0,1,0,1,0,0,6
"AC Gilchrist, VRV Singh",4,2,0,0,3,0,0,9
"SMSM Senanayake, AD Mathews",0,0,1,0,0,0,0,1
"Shakib Al Hasan, RP Singh",2,0,0,0,0,0,1,2
"UA Birla, L Balaji",5,2,0,0,0,0,0,7
"R Dravid, JR Hopes",1,2,0,0,2,0,0,5
"R Rampaul, R Bhatia",1,2,0,0,0,0,0,3
"RE Levi, JA Morkel",4,2,0,0,0,0,0,6
"SR Tendulkar, Yuvraj Singh",5,9,1,0,2,0,1,17
"SA Asnodkar, PJ Sangwan",3,0,0,0,1,1,0,5
"SP Narine, B Kumar",7,3,0,0,0,0,1,10
"R Rampaul, SP Narine",1,0,0,0,0,0,1,1
"ML Hayden, I Sharma",7,3,2,0,0,1,1,13
"RV Uthappa, MC Henriques",11,20,1,0,3,5,1,40
"SC Ganguly, JDP Oram",1,1,1,0,1,0,0,4
"WP Saha, AD Russell",1,2,0,0,0,0,0,3
"DPMD Jayawardene, JA Morkel",8,7,0,0,4,1,3,20
"VVS Laxman, WD Parnell",1,0,0,0,0,0,1,1
"A Choudhary, AJ Tye",1,2,0,0,0,0,0,3
"R Bhatia, Mohammed Shami",1,2,0,0,0,0,1,3
"S Badrinath, SM Harwood",1,0,1,0,3,1,0,6
"DPMD Jayawardene, AC Thomas",6,3,1,0,2,0,1,12
"KS Williamson, CH Morris",8,5,0,0,2,0,2,15
"SK Raina, RD Chahar",0,1,1,0,0,1,0,3
"RA Jadeja, KH Pandya",5,1,0,0,0,1,1,7
"KM Jadhav, P Awana",4,0,0,0,0,0,1,4
"SV Samson, KA Pollard",0,5,2,0,1,0,0,8
"UA Birla, JH Kallis",1,1,0,0,0,0,0,2
"KD Karthik, J Syed Mohammad",2,13,3,0,3,1,0,22
"AC Gilchrist, MS Gony",10,7,1,0,3,1,1,22
"GC Smith, SB Bangar",0,3,0,0,0,0,0,3
"AR Patel, SN Thakur",2,1,0,0,1,0,0,4
"TL Suman, A Mishra",6,8,0,0,0,0,0,14
"CH Gayle, Mustafizur Rahman",2,2,0,0,0,0,0,4
"SK Raina, SMSM Senanayake",2,0,1,0,1,0,0,4
"SL Malinga, Z Khan",0,1,0,0,0,0,0,1
"M Manhas, MS Gony",1,2,0,0,0,0,0,3
"MK Pandey, CL White",3,1,0,0,0,0,0,4
"BB McCullum, R McLaren",8,2,1,0,2,0,0,13
"KA Pollard, Shivam Sharma",1,1,0,0,0,1,0,3
"PA Patel, JH Kallis",20,10,0,0,6,0,2,36
"MS Dhoni, DP Nannes",3,0,0,0,0,0,2,3
"KC Sangakkara, Shoaib Ahmed",1,0,2,0,0,0,1,3
"A Symonds, MM Patel",4,2,0,1,4,0,0,11
"UBT Chand, Ankit Sharma",0,2,0,0,1,0,0,3
"RV Uthappa, KMDN Kulasekara",3,1,0,0,1,0,1,5
"R Sathish, SE Bond",0,4,0,0,2,0,0,6
"A Ashish Reddy, KK Cooper",1,2,1,0,1,0,0,5
"JH Kallis, RR Powar",0,2,0,0,0,0,0,2
"V Kohli, VRV Singh",4,3,0,0,0,0,1,7
"HH Pandya, P Kumar",2,2,0,0,1,0,1,5
"BB McCullum, DT Christian",0,2,0,0,0,1,0,3
"A Mishra, JJ Bumrah",2,0,0,0,0,0,1,2
"Iqbal Abdulla, SB Jakati",1,4,0,0,0,1,0,6
"KJ Abbott, YS Chahal",1,0,0,0,0,0,1,1
"V Shankar, MJ McClenaghan",0,3,0,0,0,0,0,3
"MR Marsh, DJ Bravo",3,2,1,0,0,0,1,6
"RS Bopara, WPUJC Vaas",3,1,0,0,2,0,0,6
"K Goel, ST Jayasuriya",0,2,0,0,0,0,0,2
"SA Yadav, T Shamsi",1,1,0,0,1,0,0,3
"KK Nair, L Balaji",2,0,0,0,1,0,1,3
"V Sehwag, TG Southee",1,0,0,0,0,0,1,1
"CH Gayle, AJ Tye",2,2,0,0,0,0,1,4
"MN van Wyk, IK Pathan",1,2,0,0,0,1,0,4
"Mohammed Shami, SW Tait",0,1,1,0,0,0,0,2
"JP Faulkner, Shakib Al Hasan",1,2,0,0,0,0,0,3
"R Dravid, Shakib Al Hasan",5,4,1,0,0,0,1,10
"MC Henriques, UT Yadav",3,8,1,0,2,0,1,14
"AB de Villiers, JP Duminy",5,9,1,0,1,0,0,16
"J Botha, KK Cooper",1,1,0,0,0,0,1,2
"SE Marsh, DJ Hussey",3,3,0,0,0,1,1,7
"PA Patel, BJ Hodge",5,3,1,0,1,0,0,10
"SS Iyer, MC Henriques",2,4,1,0,2,0,0,9
"S Dhawan, AC Thomas",1,2,0,0,0,0,0,3
"KB Arun Karthik, DS Kulkarni",1,2,0,0,0,1,0,4
"HH Gibbs, R Vinay Kumar",9,4,3,0,2,2,0,20
"AP Dole, RJ Harris",1,0,0,0,1,0,1,2
"RG Sharma, V Kohli",1,5,1,0,0,0,0,7
"SS Tiwary, JP Faulkner",5,5,1,0,0,0,0,11
"JR Hopes, S Dhawan",0,1,0,0,0,1,0,2
"MK Tiwary, PC Valthaty",4,2,0,0,1,0,0,7
"SK Raina, JD Unadkat",5,6,2,0,2,0,0,15
"RA Jadeja, JR Hopes",1,1,1,0,0,0,0,3
"CA Pujara, A Nehra",2,3,0,0,2,0,0,7
"JP Duminy, RP Singh",13,1,0,0,3,1,0,18
"HH Pandya, JP Faulkner",0,2,0,0,0,0,0,2
"MC Henriques, MG Johnson",0,3,0,0,0,0,0,3
"IK Pathan, DT Christian",2,2,0,0,1,0,0,5
"SE Marsh, LR Shukla",0,3,0,0,0,1,0,4
"Kuldeep Yadav, P Negi",1,1,0,0,0,0,0,2
"AT Rayudu, RG Sharma",2,4,0,0,1,0,0,7
"Yuvraj Singh, DJG Sammy",3,1,0,0,0,0,0,4
"S Dhawan, GJ Maxwell",2,8,1,0,3,0,1,14
"YK Pathan, VR Aaron",13,4,2,1,3,2,2,25
"DW Steyn, IK Pathan",2,0,2,0,1,0,0,5
"P Negi, R Ashwin",1,4,0,0,0,0,0,5
"LA Carseldine, SK Raina",0,2,0,0,0,0,0,2
"AJ Finch, AF Milne",5,1,0,0,2,0,0,8
"Mohammad Nabi, Sandeep Sharma",2,0,1,0,0,0,1,3
"RA Jadeja, T Natarajan",2,1,0,0,0,0,0,3
"WP Saha, M Ashwin",0,1,0,0,0,0,0,1
"AL Menaria, CK Langeveldt",0,1,0,0,1,0,0,2
"SA Yadav, JP Duminy",2,1,1,0,0,1,0,5
"UT Yadav, AB Dinda",1,2,0,0,0,0,0,3
"Z Khan, VRV Singh",3,0,0,0,0,0,0,3
"AT Rayudu, BA Bhatt",4,6,1,0,3,0,0,14
"SK Trivedi, Shakib Al Hasan",1,0,0,0,0,0,0,1
"KC Sangakkara, Z Khan",7,7,1,0,4,0,0,19
"MN van Wyk, ST Jayasuriya",0,2,0,0,0,0,0,2
"KS Williamson, Mohammed Shami",5,4,0,0,1,0,1,11
"EJG Morgan, SR Watson",3,3,3,0,2,2,1,13
"TM Dilshan, Shoaib Ahmed",4,2,2,0,4,1,0,13
"ST Jayasuriya, Kamran Khan",3,0,0,1,0,1,0,5
"DW Steyn, B Kumar",1,1,0,0,0,0,1,2
"AM Rahane, NLTC Perera",0,2,0,0,0,0,0,2
"IK Pathan, Anand Rajan",5,4,0,0,0,0,0,9
"MK Pandey, M Morkel",3,7,1,0,1,1,0,13
"Misbah-ul-Haq, PJ Sangwan",1,1,1,0,1,1,0,5
"SM Katich, Mohammad Asif",4,0,1,1,4,0,0,10
"JEC Franklin, B Kumar",6,4,1,0,0,1,1,12
"DE Bollinger, RJ Harris",2,0,1,0,0,0,0,3
"Mandeep Singh, R Vinay Kumar",5,7,3,0,4,0,2,19
"SK Warne, BA Bhatt",1,1,0,0,1,0,0,3
"S Dhawan, CR Brathwaite",1,1,0,0,0,0,0,2
"RA Tripathi, P Kumar",2,2,1,0,2,2,0,9
"H Das, DJ Bravo",2,1,0,0,0,0,0,3
"DJ Hussey, A Singh",4,0,0,0,2,0,0,6
"AB de Villiers, KC Cariappa",1,6,1,0,2,1,1,11
"SK Warne, CH Gayle",0,2,0,0,0,0,0,2
"SC Ganguly, RJ Harris",5,2,0,0,1,0,0,8
"AP Majumdar, J Botha",1,0,0,0,1,0,1,2
"NV Ojha, J Suchith",3,2,2,0,0,0,2,7
"S Dhawan, KC Cariappa",3,6,2,0,2,0,0,13
"MK Tiwary, B Kumar",9,10,0,0,4,0,2,23
"T Taibu, A Mishra",2,2,0,0,0,0,0,4
"HH Pandya, I Sharma",9,0,0,0,4,1,0,14
"SE Marsh, Shakib Al Hasan",4,3,2,0,1,0,0,10
"R Sathish, CH Morris",0,1,0,0,0,0,0,1
"JEC Franklin, DW Steyn",7,3,0,0,0,0,0,10
"ND Doshi, S Sreesanth",4,0,0,0,0,0,0,4
"RN ten Doeschate, DJ Bravo",4,4,1,0,2,1,0,12
"AM Nayar, SK Trivedi",3,6,1,0,1,0,0,11
"AT Rayudu, DT Christian",6,8,1,0,0,0,0,15
"B Lee, RA Jadeja",1,0,0,0,0,0,0,1
"AB McDonald, DE Bollinger",1,0,1,0,0,0,1,2
"PA Patel, JP Duminy",10,5,0,0,2,0,0,17
"R Bhatia, B Lee",3,1,0,0,0,0,1,4
"R Dravid, KP Appanna",4,2,1,0,2,0,1,9
"JP Faulkner, DW Steyn",4,3,0,0,1,0,0,8
"KD Karthik, M de Lange",2,1,0,0,0,0,1,3
"SPD Smith, B Kumar",6,6,3,0,0,0,0,15
"A Ashish Reddy, NM Coulter-Nile",1,0,0,0,0,0,0,1
"AL Menaria, M Kartik",0,3,1,0,0,1,0,5
"AP Tare, DW Steyn",7,2,1,0,1,0,1,11
"Mandeep Singh, GJ Maxwell",1,0,0,0,0,0,1,1
"DA Miller, GB Hogg",2,4,0,0,0,0,0,6
"NV Ojha, CJ McKay",1,0,0,1,1,0,0,3
"V Sehwag, RJ Peterson",2,1,0,0,0,1,1,4
"RN ten Doeschate, KV Sharma",2,3,1,0,0,0,0,6
"NS Naik, BB Sran",0,5,2,0,0,0,0,7
"STR Binny, AB Dinda",1,0,0,0,0,0,1,1
"Mandeep Singh, DJ Bravo",4,5,2,0,0,0,1,11
"DJ Hussey, Shakib Al Hasan",7,5,3,0,1,1,0,17
"MG Johnson, MJ McClenaghan",1,1,0,0,0,0,1,2
"MP Stoinis, CJ Jordan",2,2,3,0,2,1,0,10
"SC Ganguly, DJ Thornely",3,2,0,0,0,0,1,5
"SP Goswami, V Pratap Singh",1,1,1,0,0,0,1,3
"A Mishra, DJ Bravo",0,2,0,0,0,0,0,2
"ML Hayden, IK Pathan",11,4,1,0,5,0,1,21
"Q de Kock, MM Sharma",7,5,0,0,2,0,1,14
"Ishan Kishan, JD Unadkat",2,2,2,0,0,1,0,7
"JEC Franklin, DT Christian",2,1,1,0,1,0,0,5
"GC Smith, TM Dilshan",1,2,0,0,0,0,0,3
"MS Bisla, A Kumble",6,8,2,0,0,1,1,17
"R McLaren, R Sharma",2,2,0,0,1,0,0,5
"DJ Hooda, GJ Maxwell",1,1,0,0,0,2,0,4
"SE Marsh, TG Southee",2,1,0,0,0,0,1,3
"S Dhawan, PP Chawla",9,18,2,0,3,2,0,34
"R Sathish, B Lee",1,0,2,0,0,0,0,3
"KS Williamson, A Mishra",4,12,3,0,2,2,0,23
"DPMD Jayawardene, HV Patel",2,4,0,0,0,0,0,6
"LRPL Taylor, DR Smith",3,2,0,0,0,0,0,5
"JD Ryder, M Kartik",2,3,0,0,0,0,0,5
"SV Samson, YS Chahal",9,6,1,0,1,1,2,18
"AN Ghosh, AM Nayar",1,0,0,0,0,0,1,1
"WP Saha, BA Stokes",2,3,0,0,2,0,0,7
"P Negi, MJ McClenaghan",11,5,5,0,1,1,1,23
"V Sehwag, DW Steyn",20,11,1,0,5,0,2,37
"UT Yadav, SR Watson",4,0,0,0,1,0,0,5
"R Tewatia, BA Stokes",1,0,0,0,1,0,0,2
"SR Tendulkar, A Chandila",4,4,0,0,0,0,1,8
"AC Blizzard, P Kumar",4,0,0,0,3,0,1,7
"MEK Hussey, KW Richardson",3,0,0,0,0,0,1,3
"SA Asnodkar, I Sharma",1,3,0,0,2,0,1,6
"JD Ryder, UT Yadav",6,4,1,0,4,3,0,18
"CA Pujara, Kamran Khan",2,2,0,0,1,0,0,5
"Basil Thampi, AF Milne",1,0,0,0,0,0,0,1
"CA Ingram, SL Malinga",1,0,0,0,0,0,1,1
"MK Tiwary, DJ Bravo",3,5,0,0,2,0,0,10
"AB de Villiers, PP Ojha",10,18,0,1,3,1,0,33
"RV Uthappa, PJ Sangwan",7,9,1,0,0,0,2,17
"RA Jadeja, HV Patel",2,1,1,0,1,0,0,5
"CH Gayle, SP Narine",23,16,1,0,4,1,2,45
"V Kohli, DE Bollinger",12,6,2,0,4,0,1,24
"SR Tendulkar, R Ashwin",10,15,2,0,5,0,1,32
"JR Hopes, JDP Oram",4,2,0,0,5,0,0,11
"KD Karthik, S Aravind",2,4,0,0,0,0,1,6
"YK Pathan, SB Styris",4,2,0,0,0,1,0,7
"SS Tiwary, SW Tait",3,2,0,0,0,0,1,5
"V Kohli, TL Suman",0,1,0,0,0,0,0,1
"NV Ojha, YS Chahal",4,2,0,0,0,1,1,7
"DL Vettori, Azhar Mahmood",0,1,0,0,0,0,0,1
"KC Sangakkara, JP Duminy",4,11,2,0,0,2,0,19
"JP Duminy, KW Richardson",5,3,0,0,2,1,1,11
"Yashpal Singh, AM Nayar",0,3,0,0,0,0,0,3
"P Kumar, KMDN Kulasekara",1,1,2,0,0,0,0,4
"Mohammed Shami, AD Russell",1,0,0,0,0,0,0,1
"JH Kallis, S Aravind",0,1,0,0,0,0,0,1
"B Chipli, R Vinay Kumar",1,0,0,0,0,0,1,1
"KA Pollard, HV Patel",9,6,1,0,3,1,0,20
"TL Suman, JH Kallis",8,8,0,0,0,0,0,16
"KA Pollard, MC Henriques",3,3,0,0,0,0,1,6
"AJ Finch, S Kaul",4,3,1,0,0,1,1,9
"RE Levi, DJ Bravo",4,0,0,0,0,1,1,5
"AC Gilchrist, S Kaul",0,2,0,0,1,0,0,3
"V Sehwag, VR Aaron",5,4,2,0,2,0,0,13
"DJ Bravo, DJ Hooda",1,4,1,0,1,0,0,7
"RN ten Doeschate, MM Patel",2,2,0,0,1,0,0,5
"SP Jackson, B Kumar",1,4,0,0,0,0,1,5
"WP Saha, Bipul Sharma",1,1,0,0,0,0,0,2
"S Sohal, I Sharma",2,2,0,0,0,0,0,4
"MS Dhoni, Pankaj Singh",1,2,0,0,0,0,0,3
"S Sreesanth, MF Maharoof",2,1,0,0,0,0,0,3
"KA Pollard, Anand Rajan",2,1,1,0,1,1,1,6
"LR Shukla, Z Khan",4,2,1,0,0,0,2,7
"KM Jadhav, R Vinay Kumar",4,9,0,0,4,2,0,19
"JP Duminy, DJ Hooda",5,9,1,0,0,0,0,15
"JA Morkel, IK Pathan",1,6,0,0,1,0,0,8
"AM Nayar, D du Preez",0,2,1,0,2,0,0,5
"M Kaif, IK Pathan",1,1,0,0,0,0,0,2
"MEK Hussey, Sunny Gupta",0,4,0,0,1,0,0,5
"CA Pujara, VR Aaron",2,1,0,0,0,0,0,3
"JP Faulkner, Mohammed Siraj",1,1,0,0,1,0,1,3
"AB Dinda, Sohail Tanvir",1,1,0,0,0,0,0,2
"GJ Maxwell, DJ Bravo",2,1,0,0,0,0,1,3
"LR Shukla, RP Singh",0,0,0,0,2,1,0,3
"RR Pant, RA Jadeja",4,1,0,0,1,1,1,7
"PA Patel, JJ Bumrah",3,4,0,0,2,0,0,9
"AD Nath, B Kumar",1,0,0,0,0,0,1,1
"R Bhatia, RP Singh",4,7,0,0,3,0,2,14
"DJG Sammy, BMAJ Mendis",2,4,1,0,0,1,0,8
"Niraj Patel, R Vinay Kumar",3,1,0,0,0,0,0,4
"AM Rahane, P Negi",8,17,2,0,0,0,1,27
"BB McCullum, Sandeep Sharma",17,4,4,0,5,1,2,31
"Gurkeerat Singh, MA Starc",1,1,0,0,0,0,1,2
"RA Tripathi, Rashid Khan",2,4,0,0,1,0,0,7
"RR Sarwan, L Balaji",2,1,0,0,0,0,1,3
"GJ Maxwell, S Aravind",2,2,1,0,0,0,1,5
"S Sohal, IK Pathan",3,2,0,0,3,0,0,8
"PA Patel, A Mithun",1,2,0,0,1,0,0,4
"R Dhawan, B Kumar",2,1,0,0,0,0,1,3
"BB McCullum, P Awana",6,1,1,0,2,1,0,11
"KD Karthik, I Sharma",9,6,1,0,1,0,2,17
"AC Thomas, M Muralitharan",0,1,0,0,0,0,0,1
"AC Gilchrist, YK Pathan",24,10,3,0,4,0,2,41
"GH Vihari, R Ashwin",0,1,0,0,0,0,0,1
"PJ Cummins, YS Chahal",1,0,0,0,0,0,0,1
"RV Uthappa, BA Bhatt",1,4,1,0,0,0,0,6
"WP Saha, GD McGrath",1,2,0,0,0,0,0,3
"DPMD Jayawardene, RP Singh",11,16,2,0,11,1,0,41
"KD Karthik, A Chandila",0,2,0,0,0,0,0,2
"MM Sharma, BB Sran",1,1,0,0,0,1,0,3
"AB McDonald, Harbhajan Singh",3,4,1,0,0,0,0,8
"RN ten Doeschate, IC Pandey",1,1,0,0,0,0,0,2
"SM Katich, AB Dinda",2,2,1,0,0,1,0,6
"A Nehra, KA Pollard",1,0,0,0,0,0,1,1
"A Kumble, SL Malinga",0,1,0,0,0,0,0,1
"M Vohra, Shakib Al Hasan",8,10,1,0,1,2,0,22
"S Badrinath, SK Trivedi",8,7,1,1,3,0,0,20
"V Sehwag, AC Voges",5,0,0,0,2,0,0,7
"AC Gilchrist, A Singh",3,2,0,0,0,0,1,5
"AD Russell, R Ashwin",2,0,0,0,0,0,1,2
"V Sehwag, JM Kemp",0,2,1,0,1,1,0,5
"KV Sharma, JA Morkel",1,1,1,0,0,0,0,3
"KK Nair, B Kumar",12,2,0,0,6,0,0,20
"RA Tripathi, Sandeep Sharma",1,2,0,0,1,0,0,4
"DPMD Jayawardene, KP Appanna",0,1,0,0,0,0,0,1
"WA Mota, MM Patel",1,1,0,0,0,0,0,2
"SP Goswami, Shakib Al Hasan",4,4,0,0,0,0,1,8
"RV Uthappa, WD Parnell",6,3,0,0,1,0,1,10
"S Dhawan, SB Bangar",2,1,1,0,0,0,0,4
"AM Nayar, DT Christian",4,0,1,0,2,0,0,7
"BJ Rohrer, MC Henriques",0,1,0,0,0,0,0,1
"Kamran Akmal, PP Chawla",1,1,0,0,0,0,1,2
"KA Pollard, NLTC Perera",4,4,0,0,4,5,0,17
"RE van der Merwe, Harbhajan Singh",2,1,0,0,0,0,1,3
"A Nehra, MA Starc",2,0,0,0,0,0,0,2
"PA Patel, AM Salvi",0,2,0,0,0,0,0,2
"MN Samuels, KA Pollard",0,2,0,0,0,0,0,2
"M Vijay, TM Dilshan",0,2,0,0,0,0,0,2
"IK Pathan, R Rampaul",5,3,0,0,2,3,0,13
"F du Plessis, Anureet Singh",1,2,0,0,0,0,0,3
"MC Henriques, Parvez Rasool",4,3,0,0,0,0,0,7
"Y Venugopal Rao, RA Jadeja",3,10,0,0,2,1,1,16
"MEK Hussey, R Bhatia",8,27,3,0,5,1,0,44
"MK Tiwary, RW Price",0,5,0,0,1,1,0,7
"V Kohli, J Botha",1,2,0,0,1,0,0,4
"GJ Bailey, M Kartik",2,3,0,0,0,0,0,5
"AR Patel, PV Tambe",2,5,1,0,1,0,0,9
"BJ Hodge, S Aravind",2,0,0,0,0,0,1,2
"LA Pomersbach, DE Bollinger",2,1,0,0,0,0,1,3
"M Morkel, RA Jadeja",0,2,0,0,0,0,0,2
"JJ van der Wath, JA Morkel",3,1,0,0,0,1,0,5
"KV Sharma, AD Mathews",1,2,0,0,0,0,0,3
"MS Bisla, STR Binny",1,2,0,0,0,0,0,3
"TM Dilshan, PP Chawla",5,0,0,0,0,0,0,5
"RE van der Merwe, CH Gayle",2,1,0,0,0,1,0,4
"WP Saha, Yuvraj Singh",2,3,2,0,1,0,0,8
"JH Kallis, A Symonds",8,13,0,0,2,0,0,23
"M Kaif, A Symonds",2,3,0,0,1,3,0,9
"Gurkeerat Singh, Harbhajan Singh",1,1,0,0,0,0,1,2
"V Kohli, Y Venugopal Rao",0,2,0,0,1,0,0,3
"AM Rahane, SB Bangar",3,0,0,0,0,0,1,3
"KL Rahul, Anureet Singh",3,5,2,0,0,1,0,11
"RS Bopara, JH Kallis",5,13,0,1,3,1,1,23
"F du Plessis, J Suchith",2,5,0,0,0,0,1,7
"MC Henriques, R Vinay Kumar",2,3,0,0,0,0,0,5
"SR Watson, DR Smith",5,5,1,0,1,1,0,13
"MS Dhoni, C Nanda",4,4,0,0,0,0,0,8
"MS Dhoni, PV Tambe",6,7,0,0,1,0,1,14
"JC Buttler, I Sharma",3,3,0,0,2,0,0,8
"KV Sharma, Imran Tahir",3,3,0,0,0,3,0,9
"YK Pathan, GD McGrath",5,3,0,0,2,1,0,11
"F du Plessis, UT Yadav",4,2,0,0,2,0,0,8
"R Dravid, Harmeet Singh",11,6,2,0,5,2,2,26
"OA Shah, Z Khan",5,1,0,0,2,0,2,8
"N Saini, RJ Peterson",2,2,0,0,0,0,0,4
"TD Paine, AG Murtaza",2,1,0,0,0,0,0,3
"M Kaif, Z Khan",5,0,0,0,1,0,0,6
"JP Duminy, SR Watson",8,2,2,0,2,1,0,15
"CL White, B Kumar",6,10,4,0,2,1,1,23
"JH Kallis, NLTC Perera",2,8,0,0,1,0,0,11
"SR Watson, Azhar Mahmood",3,3,0,0,4,1,0,11
"G Gambhir, D Wiese",2,1,0,0,1,0,1,4
"HM Amla, IK Pathan",4,2,0,0,2,0,0,8
"MK Pandey, JO Holder",2,1,0,0,0,0,0,3
"CH Morris, Sandeep Sharma",2,4,2,0,0,1,1,9
"R Dravid, S Nadeem",8,21,0,0,4,0,0,33
"S Nadeem, RA Jadeja",2,2,0,0,0,0,1,4
"TM Dilshan, A Singh",3,0,0,1,0,0,0,4
"PC Valthaty, STR Binny",0,2,1,0,0,0,0,3
"DJ Hussey, Harmeet Singh",0,0,2,0,1,2,0,5
"MA Agarwal, MC Henriques",2,3,1,0,1,0,0,7
"C de Grandhomme, KV Sharma",1,0,0,0,0,0,1,1
"AS Raut, DS Kulkarni",1,1,0,0,0,0,0,2
"A Symonds, S Randiv",5,1,1,0,1,0,0,8
"AM Rahane, R Rampaul",10,2,1,0,0,1,1,14
"JP Duminy, HV Patel",9,10,0,0,4,0,0,23
"MA Agarwal, AN Ahmed",4,4,0,0,0,0,1,8
"M Kaif, R Ashwin",2,2,0,0,0,0,0,4
"KM Jadhav, AJ Tye",5,2,2,0,3,1,0,13
"MK Pandey, SA Abbott",0,1,0,0,2,0,0,3
"KA Pollard, JH Kallis",3,4,0,0,0,0,1,7
"RA Jadeja, Iqbal Abdulla",4,4,0,0,0,1,1,9
"DJ Bravo, Joginder Sharma",4,1,0,0,0,0,2,5
"WPUJC Vaas, VY Mahesh",1,1,2,0,0,1,0,5
"SM Katich, KP Appanna",1,1,0,0,0,0,0,2
"SC Ganguly, RP Singh",7,4,0,0,2,0,0,13
"MN Samuels, DL Vettori",1,4,1,0,1,0,0,7
"JA Morkel, JR Hopes",0,1,0,0,0,0,0,1
"UT Yadav, CH Morris",0,3,0,0,0,0,0,3
"MJ McClenaghan, Kuldeep Yadav",2,1,0,0,0,1,1,4
"RP Singh, DW Steyn",3,1,0,0,0,0,2,4
"P Kumar, L Balaji",0,3,2,0,1,2,0,8
"SC Ganguly, VS Malik",6,5,0,0,0,0,0,11
"SC Ganguly, MM Patel",16,8,3,0,3,3,2,33
"M Manhas, S Randiv",3,3,1,0,0,1,0,8
"AJ Finch, LH Ferguson",1,1,1,0,1,2,0,6
"S Dhawan, J Yadav",5,13,2,0,1,0,0,21
"MEK Hussey, M Muralitharan",3,4,0,0,1,0,0,8
"B Sumanth, A Mishra",2,0,0,0,0,0,0,2
"SP Narine, STR Binny",1,0,0,0,1,0,1,2
"M Morkel, P Kumar",6,0,1,0,0,0,0,7
"LMP Simmons, K Rabada",3,3,1,0,1,1,0,9
"M Vijay, DL Chahar",0,3,0,0,1,1,0,5
"SM Katich, RP Singh",1,3,0,0,2,0,0,6
"AUK Pathan, SL Malinga",2,0,0,0,0,0,1,2
"DJ Hussey, JA Morkel",3,1,1,0,0,0,1,5
"V Sehwag, DJ Hussey",1,0,0,0,0,3,1,4
"Anureet Singh, P Kumar",1,0,0,0,0,0,1,1
"KH Pandya, Kuldeep Yadav",0,0,0,1,0,0,0,1
"RA Jadeja, SK Raina",4,9,0,0,1,0,0,14
"Yuvraj Singh, AD Mathews",2,4,0,0,1,0,0,7
"SD Chitnis, DJ Bravo",4,2,0,0,1,0,1,7
"SP Fleming, Shoaib Akhtar",2,0,1,0,2,0,0,5
"PP Chawla, KV Sharma",1,2,0,0,0,2,0,5
"Z Khan, P Kumar",1,0,1,0,2,1,0,5
"PA Patel, A Kumble",3,6,0,0,0,0,1,9
"SB Styris, YK Pathan",1,2,0,0,0,1,1,4
"AR Patel, WD Parnell",3,1,0,0,3,0,0,7
"Yuvraj Singh, AR Patel",11,7,1,0,1,3,1,23
"CJ Jordan, Mustafizur Rahman",2,0,1,0,0,0,0,3
"MJ Guptill, Z Khan",7,2,0,0,0,0,1,9
"RN ten Doeschate, SL Malinga",5,7,0,0,1,1,0,14
"GJ Bailey, Sandeep Sharma",2,0,0,0,0,0,0,2
"RA Jadeja, MC Henriques",1,3,1,0,1,0,0,6
"J Botha, V Pratap Singh",0,1,0,0,0,0,0,1
"MK Tiwary, Z Khan",4,8,1,0,0,0,1,13
"PA Patel, DW Steyn",25,11,3,0,7,1,1,47
"A Mishra, JO Holder",6,1,1,0,2,0,0,10
"JR Hopes, Yuvraj Singh",0,1,1,0,0,0,0,2
"MEK Hussey, JA Morkel",4,2,0,0,0,0,1,6
"VY Mahesh, MM Patel",4,1,0,0,0,0,1,5
"SW Billings, M Ashwin",3,1,0,0,1,0,0,5
"SS Iyer, UT Yadav",8,8,1,0,3,0,0,20
"MS Wade, CH Gayle",0,1,0,0,0,0,0,1
"KC Sangakkara, P Amarnath",2,5,1,0,1,0,0,9
"RV Gomez, I Sharma",1,0,0,0,0,0,1,1
"EJG Morgan, RN ten Doeschate",1,0,0,0,0,0,0,1
"P Kumar, SB Wagh",1,2,0,0,0,0,0,3
"JE Taylor, JA Morkel",1,0,1,0,0,0,0,2
"MS Dhoni, DJ Bravo",8,13,3,0,6,2,0,32
"DB Ravi Teja, AB Dinda",2,4,0,0,1,0,0,7
"B Laughlin, MG Johnson",0,1,0,0,0,0,0,1
"R Ashwin, KA Pollard",4,5,0,0,0,0,1,9
"Y Venugopal Rao, WA Mota",3,3,0,0,1,1,0,8
