key,0s,1s,2s,3s,4s,6s,outs,balls
"PP Ojha, R Bhatia",2,0,0,0,0,0,1,2
"M Kaif, R McLaren",1,1,1,0,0,0,0,3
"Y Venugopal Rao, Iqbal Abdulla",2,5,0,0,0,0,0,7
"STR Binny, CH Morris",4,4,1,0,3,0,0,12
"Gurkeerat Singh, A Nehra",3,2,1,0,2,0,0,8
"SA Asnodkar, A Symonds",6,3,2,0,2,1,0,14
"Harbhajan Singh, AB Agarkar",1,2,0,0,2,1,0,6
"JC Buttler, YS Chahal",2,2,0,0,0,1,0,5
"LJ Wright, S Nadeem",3,3,0,0,1,0,0,7
"LA Carseldine, IK Pathan",0,4,1,0,2,0,0,7
"CJ Anderson, A Nehra",7,0,0,0,1,0,1,8
"LA Carseldine, JH Kallis",1,0,0,0,1,0,0,2
"SK Raina, JP Faulkner",2,3,0,0,1,0,1,6
"GJ Bailey, AD Russell",4,5,1,0,2,0,0,12
"DR Smith, JA Morkel",16,3,6,0,9,2,1,36
"AT Rayudu, R Bhatia",4,10,1,0,2,0,1,17
"SA Yadav, SR Watson",3,5,0,0,1,1,0,10
"MP Stoinis, Iqbal Abdulla",1,1,0,0,0,0,0,2
"SR Watson, R Sharma",4,2,1,0,2,1,0,10
"JH Kallis, BAW Mendis",4,3,1,0,1,0,0,9
"JP Duminy, KH Pandya",0,8,0,0,0,0,0,8
"Q de Kock, JP Faulkner",3,3,0,0,0,0,0,6
"Niraj Patel, SS Sarkar",0,3,0,0,0,0,0,3
"Azhar Mahmood, SK Trivedi",5,6,1,0,2,1,0,15
"AP Tare, JA Morkel",12,1,1,0,2,0,2,16
"SE Marsh, VS Malik",4,0,0,0,2,0,1,6
"B Akhil, UT Yadav",1,1,2,0,0,1,0,5
"MK Pandey, NM Coulter-Nile",5,3,0,0,2,0,0,10
"YV Takawale, SR Watson",1,3,0,0,5,1,0,10
"DPMD Jayawardene, DR Smith",1,4,0,0,0,1,0,6
"SPD Smith, DP Nannes",0,1,1,0,1,1,0,4
"M Vijay, RA Jadeja",6,11,1,0,1,0,2,19
"S Badree, VR Aaron",1,1,0,0,0,0,0,2
"RG Sharma, JP Faulkner",8,3,0,0,3,3,2,17
"AC Gilchrist, BW Hilfenhaus",7,2,0,0,1,0,0,10
"AD Mathews, I Sharma",1,2,0,0,0,0,0,3
"SP Fleming, DP Vijaykumar",9,1,2,0,3,0,1,15
"MS Gony, PP Chawla",4,1,0,0,0,1,1,6
"J Botha, Shakib Al Hasan",1,1,0,0,0,0,0,2
"GC Smith, Y Venugopal Rao",0,2,1,0,0,0,0,3
"KA Pollard, Imran Tahir",7,8,0,0,1,3,1,19
"R Bhatia, JP Duminy",3,1,0,0,0,0,0,4
"CA Pujara, JR Hopes",1,3,0,0,0,0,0,4
"Q de Kock, UT Yadav",7,0,0,0,1,1,1,9
"KK Nair, DJ Hooda",0,8,0,0,1,0,0,9
"JDP Oram, RR Powar",2,1,0,0,0,0,0,3
"MJ Clarke, J Botha",1,1,0,0,0,0,0,2
"SV Samson, K Santokie",2,0,0,0,0,0,1,2
"SM Katich, S Tyagi",0,1,0,0,0,0,0,1
"P Kumar, BCJ Cutting",0,2,0,0,0,0,0,2
"SR Tendulkar, AJ Finch",10,2,2,0,2,0,1,16
"Gurkeerat Singh, B Kumar",1,0,0,0,1,0,1,2
"DA Warner, CJ Jordan",4,2,0,0,2,0,0,8
"CL White, BA Bhatt",0,2,1,0,0,0,0,3
"HH Gibbs, UT Yadav",2,2,0,0,0,0,0,4
"SB Wagh, KA Pollard",1,0,0,0,0,0,0,1
"KP Pietersen, RG Sharma",3,1,1,0,2,1,0,8
"KA Pollard, MG Johnson",6,5,3,0,2,1,0,17
"CJ Anderson, Harbhajan Singh",0,1,0,0,1,0,0,2
"RV Uthappa, JH Kallis",5,8,0,0,3,0,0,16
"RG Sharma, Basil Thampi",1,5,0,0,0,0,0,6
"Yuvraj Singh, P Negi",1,2,0,0,1,0,1,4
"KC Sangakkara, PP Chawla",2,1,0,0,0,0,1,3
"KV Sharma, R Vinay Kumar",1,1,1,0,1,0,0,4
"GJ Bailey, A Kumble",8,4,0,0,0,0,0,12
"DT Christian, PJ Cummins",0,1,0,0,0,0,0,1
"SN Thakur, Imran Tahir",1,2,0,0,0,0,0,3
"MEK Hussey, AN Ahmed",1,2,0,0,0,0,0,3
"M Kartik, Z Khan",0,1,1,0,1,0,0,3
"Shoaib Malik, SM Pollock",1,0,0,0,0,0,1,1
"Yuvraj Singh, Shahid Afridi",0,2,1,0,0,0,0,3
"MR Marsh, DW Steyn",3,6,0,0,2,0,1,11
"AP Majumdar, STR Binny",2,3,0,0,0,0,0,5
"M Vohra, S Ladda",0,4,1,0,1,1,0,7
"R Ashwin, MM Patel",2,1,0,0,0,0,0,3
"SB Jakati, M Morkel",1,1,0,0,0,0,0,2
"RE van der Merwe, YA Abdulla",1,0,0,0,1,2,1,4
"KD Karthik, CR Woakes",0,2,0,0,1,1,0,4
"KV Sharma, SR Watson",5,1,1,0,1,0,2,8
"PC Valthaty, AM Salvi",2,2,0,0,1,1,0,6
"KD Karthik, Mohammed Shami",5,6,2,0,3,2,1,18
"LA Carseldine, RG Sharma",1,4,1,0,1,0,0,7
"MS Bisla, SB Jakati",6,7,1,0,2,0,1,16
"GJ Maxwell, R Tewatia",3,0,0,0,0,0,1,3
"RG Sharma, Y Nagar",3,2,0,0,0,0,0,5
"JA Morkel, TL Suman",0,2,0,0,0,0,0,2
"KK Nair, BA Stokes",4,2,0,0,3,0,1,9
"SS Iyer, R Vinay Kumar",3,2,1,0,0,0,0,6
"S Dhawan, SK Raina",15,13,0,0,1,2,1,31
"Shahid Afridi, Mohammad Asif",0,2,0,0,1,1,0,4
"V Sehwag, UT Yadav",13,6,2,0,4,0,2,25
"MN van Wyk, Harbhajan Singh",5,2,3,0,1,0,0,11
"YK Pathan, AB Agarkar",5,3,0,0,4,1,0,13
"YK Pathan, D du Preez",2,1,0,0,1,0,1,4
"JD Ryder, P Awana",3,2,0,0,0,0,0,5
"Yuvraj Singh, MP Stoinis",1,2,0,0,0,0,0,3
"LA Pomersbach, MS Gony",2,1,0,0,0,0,0,3
"TM Dilshan, MG Johnson",8,2,0,0,1,0,1,11
"KC Sangakkara, YK Pathan",13,15,3,0,4,0,1,35
"AB de Villiers, KK Cooper",2,3,0,0,2,1,0,8
"AD Russell, HV Patel",3,1,1,0,2,1,0,8
"JP Duminy, KK Cooper",2,1,0,0,0,0,0,3
"RA Jadeja, B Kumar",5,16,3,0,2,0,0,26
"LMP Simmons, Sandeep Sharma",10,8,4,0,9,1,0,32
"M Vijay, NLTC Perera",6,3,0,0,5,0,2,14
"DR Smith, SMSM Senanayake",2,1,1,1,2,1,0,8
"CL White, S Nadeem",9,13,2,0,1,1,1,26
"RN ten Doeschate, M Morkel",1,1,0,0,1,1,1,4
"Shoaib Malik, DS Kulkarni",2,3,1,0,1,0,0,7
"AB de Villiers, MC Henriques",3,17,2,0,5,2,1,29
"CH Morris, NM Coulter-Nile",3,3,0,0,1,0,1,7
"TL Suman, JD Ryder",0,2,0,0,0,1,0,3
"N Rana, Mohammed Siraj",2,0,0,0,2,0,0,4
"KK Nair, Rashid Khan",2,4,0,0,1,0,0,7
"Mandeep Singh, KMDN Kulasekara",7,4,0,0,2,0,0,13
"IK Pathan, R Dhawan",3,3,0,0,0,0,2,6
"AM Nayar, A Nehra",5,2,0,0,0,0,2,7
"TM Head, KV Sharma",2,2,0,0,0,0,0,4
"KC Sangakkara, AB Agarkar",7,9,3,0,2,0,0,21
"B Kumar, UT Yadav",0,1,0,0,1,1,0,3
"AC Gilchrist, DE Bollinger",9,2,1,0,1,0,1,13
"JM Kemp, Jaskaran Singh",1,0,0,1,1,0,0,3
"F du Plessis, KK Cooper",6,7,1,0,1,0,1,15
"Sandeep Sharma, CR Brathwaite",0,1,0,0,0,0,0,1
"TM Dilshan, AD Mathews",5,4,1,0,1,0,0,11
"Anirudh Singh, A Kumble",3,3,0,0,0,0,0,6
"Harbhajan Singh, M Ashwin",7,1,2,0,1,0,0,11
"JEC Franklin, J Syed Mohammad",3,1,0,0,0,0,0,4
"LR Shukla, RR Raje",1,0,0,0,0,0,1,1
"Shoaib Akhtar, DJ Bravo",0,1,0,0,0,0,0,1
"MF Maharoof, SC Ganguly",1,3,0,0,0,0,0,4
"HH Gibbs, AD Mathews",9,9,1,0,2,0,0,21
"MK Tiwary, SK Trivedi",1,10,0,0,2,0,1,13
"AB de Villiers, Shakib Al Hasan",4,8,3,0,1,2,0,18
"SK Raina, JR Hopes",1,4,0,0,0,2,0,7
"Harbhajan Singh, Sandeep Sharma",3,5,0,0,0,0,0,8
"Bipul Sharma, J Botha",0,1,0,0,0,0,0,1
"SB Styris, Mohammad Asif",0,4,1,0,2,0,0,7
"BJ Haddin, J Syed Mohammad",4,0,0,0,0,0,1,4
"AM Rahane, PJ Sangwan",12,0,2,0,3,0,2,17
"KM Jadhav, J Botha",0,2,0,0,0,1,0,3
"A Flintoff, DW Steyn",2,4,0,0,1,1,0,8
"BJ Hodge, SB Wagh",1,0,0,0,0,0,0,1
"IR Jaggi, J Botha",2,3,1,0,1,0,0,7
"JD Ryder, DJ Bravo",3,3,1,0,1,1,0,9
"Gurkeerat Singh, IK Pathan",1,5,2,0,0,3,0,11
"BJ Hodge, RG Sharma",1,2,0,1,1,0,0,5
"DS Kulkarni, RA Jadeja",3,4,1,0,1,0,0,9
"MK Pandey, A Symonds",7,10,1,0,0,1,0,19
"AB de Villiers, CL White",1,1,0,0,0,0,1,2
"S Sriram, PP Chawla",2,0,0,0,0,0,1,2
"SC Ganguly, STR Binny",0,3,0,0,0,0,0,3
"A Symonds, JR Hopes",0,1,0,0,0,0,0,1
"ML Hayden, Harmeet Singh",1,0,0,0,0,0,1,1
"LMP Simmons, MA Starc",1,5,0,0,1,0,0,7
"Ankit Sharma, D Wiese",0,1,0,0,1,0,0,2
"A Choudhary, MM Sharma",2,2,0,0,0,0,1,4
"CH Gayle, K Upadhyay",5,3,0,0,0,2,0,10
"SK Warne, PP Chawla",2,2,0,0,1,0,0,5
"AT Rayudu, PD Collingwood",2,6,0,0,0,0,0,8
"SK Raina, GJ Maxwell",5,6,0,0,0,0,1,11
"WP Saha, KV Sharma",9,16,2,0,3,0,1,30
"J Theron, SW Tait",1,1,0,0,0,0,1,2
"R Bhatia, SB Jakati",0,1,0,0,0,0,0,1
"DA Miller, PP Ojha",4,5,1,0,1,1,0,12
"G Gambhir, BA Bhatt",7,11,4,0,4,0,0,26
"KK Nair, R Vinay Kumar",8,3,0,0,1,0,1,12
"HH Gibbs, Iqbal Abdulla",1,1,0,0,0,0,1,2
"CA Pujara, AC Voges",3,4,0,0,0,1,0,8
"MK Pandey, A Ashish Reddy",0,2,0,0,0,0,0,2
"RV Uthappa, R Ashwin",19,24,1,0,4,5,4,53
"P Kumar, SP Narine",1,0,0,0,0,0,1,1
"S Dhawan, Shivam Sharma",2,3,0,0,0,0,0,5
"RA Jadeja, S Kaul",1,6,0,0,1,0,0,8
"AM Rahane, VY Mahesh",3,3,0,0,0,0,1,6
"M Kartik, STR Binny",0,2,0,0,0,0,0,2
"AA Jhunjhunwala, R Sathish",1,2,0,0,0,0,0,3
"PJ Cummins, KV Sharma",1,1,1,0,0,0,0,3
"V Kohli, R Sharma",7,22,1,0,1,3,1,34
"CL White, AB Agarkar",4,1,1,0,0,0,1,6
"SK Raina, Harmeet Singh",5,8,1,0,2,0,0,16
"SR Tendulkar, SK Trivedi",14,25,4,0,3,2,1,48
"MS Dhoni, K Goel",0,1,1,0,2,0,0,4
"SPD Smith, Shakib Al Hasan",3,6,0,0,0,0,0,9
"R Ashwin, R Vinay Kumar",0,3,0,0,1,0,0,4
"SPD Smith, VY Mahesh",2,0,0,0,1,1,0,4
"MK Tiwary, AJ Tye",3,3,1,0,0,0,1,7
"CA Pujara, MM Patel",2,1,0,0,2,0,0,5
"KS Williamson, PJ Cummins",6,4,3,0,1,1,0,15
"P Negi, YS Chahal",0,1,0,0,0,1,0,2
"SA Asnodkar, DP Nannes",2,0,0,0,0,0,1,2
"PR Shah, P Parameswaran",0,1,0,0,0,0,0,1
"PP Chawla, P Negi",0,1,0,0,0,0,0,1
"MC Juneja, S Badree",1,1,1,0,0,0,0,3
"J Botha, AD Mathews",0,1,1,0,1,0,0,3
"IK Pathan, S Dhawan",2,0,0,0,0,0,0,2
"CA Pujara, A Kumble",3,2,0,0,0,0,0,5
"DR Smith, PP Chawla",2,4,0,0,1,1,1,8
"G Gambhir, Harmeet Singh",1,1,1,0,2,1,0,6
"A Mukund, S Sreesanth",0,1,0,0,0,0,0,1
"SP Narine, MJ McClenaghan",1,0,0,0,0,0,1,1
"BJ Hodge, B Lee",6,2,2,0,4,2,1,16
"A Mishra, Harmeet Singh",1,0,0,0,0,0,1,1
"SS Iyer, Mohammed Siraj",0,2,0,0,1,0,0,3
"RG Sharma, A Choudhary",1,3,0,0,2,0,0,6
"KP Pietersen, KJ Abbott",1,0,0,0,0,0,1,1
"YK Pathan, Azhar Mahmood",1,3,0,0,0,0,1,4
"Basil Thampi, Sandeep Sharma",0,3,1,0,1,0,0,5
"M Vijay, S Ladda",3,3,1,0,1,0,0,8
"P Negi, Iqbal Abdulla",0,1,0,0,0,0,0,1
"RV Uthappa, A Symonds",2,5,1,0,0,1,1,9
"V Kohli, RA Jadeja",31,48,12,0,5,2,2,98
"MC Henriques, JJ Bumrah",4,5,1,0,1,0,1,11
"CH Gayle, S Badree",6,4,0,0,0,1,0,11
"Y Venugopal Rao, DT Christian",5,4,0,0,0,0,0,9
"AC Gilchrist, JA Morkel",20,5,1,0,7,2,3,35
"HH Gibbs, DJ Hussey",1,2,0,0,0,0,0,3
"RG Sharma, JA Morkel",9,10,1,0,1,0,3,21
"M Vohra, MJ McClenaghan",0,3,0,0,0,0,0,3
"L Balaji, SP Narine",2,0,0,0,0,0,1,2
"RG Sharma, AC Thomas",0,3,0,0,0,0,0,3
"PA Patel, M Muralitharan",3,4,2,0,1,0,1,10
"ST Jayasuriya, JA Morkel",13,3,1,0,4,5,0,26
"Abdur Razzak, Sohail Tanvir",2,0,0,0,0,0,0,2
"VY Mahesh, LR Shukla",3,1,0,0,0,0,1,4
"AB Agarkar, RR Raje",2,2,0,0,2,0,0,6
"AJ Finch, KK Cooper",11,6,1,0,2,1,1,21
"LRPL Taylor, S Nadeem",0,1,2,0,0,0,0,3
"DA Warner, D Wiese",1,3,0,0,2,0,0,6
"MJ Lumb, T Thushara",4,0,0,0,1,0,0,5
"MS Gony, J Theron",3,1,0,0,0,0,1,4
"AD Nath, JJ Bumrah",1,1,1,0,0,0,0,3
"DJ Jacobs, A Mishra",2,1,0,0,1,0,0,4
"KA Pollard, R Bhatia",6,12,0,0,3,1,2,22
"AS Rajpoot, SL Malinga",3,0,0,0,0,0,1,3
"UBT Chand, R Vinay Kumar",6,5,0,0,1,1,1,13
"RS Bopara, TG Southee",0,2,0,0,0,0,0,2
"SK Raina, Shakib Al Hasan",12,9,2,0,3,1,2,27
"AA Jhunjhunwala, BW Hilfenhaus",0,1,0,0,0,0,0,1
"J Syed Mohammad, UT Yadav",3,2,0,0,2,0,1,7
"Mandeep Singh, CR Woakes",3,1,1,0,1,1,0,7
"BB McCullum, JJ Bumrah",13,4,1,0,5,2,1,25
"KL Rahul, JJ Bumrah",6,5,3,0,2,1,0,17
"BB McCullum, Anureet Singh",2,3,1,0,0,1,0,7
"RE van der Merwe, RJ Harris",6,1,0,0,0,2,0,9
"JH Kallis, Sohail Tanvir",4,1,0,0,0,0,0,5
"BB McCullum, JP Duminy",5,3,0,0,2,0,0,10
"KD Karthik, SM Pollock",3,3,2,0,0,0,0,8
"DA Miller, TG Southee",3,1,0,0,1,1,0,6
"JC Buttler, SN Thakur",0,0,1,0,2,0,0,3
"Ishan Kishan, K Rabada",1,1,0,0,0,0,0,2
"Harmeet Singh, SP Narine",2,0,0,0,1,0,1,3
"MK Tiwary, Mohammed Siraj",0,1,0,0,1,0,0,2
"SE Marsh, S Sreesanth",8,4,0,0,4,0,0,16
"Ishan Kishan, B Kumar",3,2,0,0,2,0,0,7
"MS Dhoni, S Sreesanth",3,5,1,0,0,0,1,9
"M Vijay, DJ Bravo",2,4,1,0,0,0,0,7
"DA Miller, GH Vihari",0,1,0,0,0,0,0,1
"RA Tripathi, I Sharma",1,1,1,0,2,0,0,5
"PP Chawla, RJ Harris",1,2,0,0,0,0,0,3
"LA Pomersbach, RG Sharma",2,2,0,0,0,0,0,4
"FY Fazal, J Theron",5,4,0,0,2,0,0,11
"JP Faulkner, MA Starc",2,2,2,0,2,1,0,9
"V Kohli, RN ten Doeschate",0,1,0,0,1,0,0,2
"WP Saha, Shakib Al Hasan",7,7,2,0,0,1,0,17
"N Rana, TS Mills",1,2,0,0,1,0,0,4
"Karanveer Singh, MA Starc",3,1,1,0,0,0,1,5
"CA Ingram, Yuvraj Singh",3,1,1,0,1,0,0,6
"KA Pollard, A Zampa",1,3,0,0,1,1,1,6
"STR Binny, YS Chahal",2,2,1,0,1,0,0,6
"MK Tiwary, Harmeet Singh",4,4,0,0,1,0,0,9
"CM Gautam, L Balaji",1,1,1,0,0,0,0,3
"AA Bilakhia, DP Nannes",5,0,1,0,1,0,0,7
"V Kohli, Pankaj Singh",9,3,1,0,3,1,1,17
"SK Raina, VS Yeligati",1,1,0,0,2,0,0,4
"M Vohra, Imran Tahir",7,4,0,0,1,0,2,12
"KB Arun Karthik, JDP Oram",6,2,0,0,2,0,0,10
"PP Chawla, FY Fazal",0,2,0,0,0,0,0,2
"SN Khan, NLTC Perera",0,0,1,0,0,0,0,1
"DPMD Jayawardene, V Kohli",1,3,0,0,1,0,0,5
"RT Ponting, IK Pathan",6,0,0,0,0,0,1,6
"YK Pathan, SL Malinga",17,26,3,0,9,1,0,56
"Ankit Soni, JD Unadkat",1,0,0,0,0,0,1,1
"PC Valthaty, Z Khan",9,3,1,0,4,0,1,17
"SPD Smith, J Suchith",2,10,2,0,2,0,0,16
"UBT Chand, B Kumar",2,0,0,0,0,0,0,2
"MD Mishra, SE Bond",0,1,1,0,1,0,0,3
"SS Iyer, D Wiese",1,2,0,0,0,0,0,3
"CH Gayle, I Sharma",5,0,0,0,2,2,1,9
"DL Vettori, IK Pathan",5,1,0,0,0,1,1,7
"DT Christian, CR Woakes",1,2,0,0,0,2,0,5
"KP Pietersen, PJ Sangwan",2,2,1,0,0,0,1,5
"MD Mishra, AG Murtaza",2,0,0,0,1,0,1,3
"SR Watson, V Sehwag",0,3,0,0,0,1,0,4
"F du Plessis, D Wiese",3,8,0,0,2,1,0,14
"BB McCullum, Parvez Rasool",3,0,0,0,1,1,0,5
"S Badrinath, SW Tait",2,1,0,0,0,0,1,3
"V Kohli, KC Cariappa",6,3,0,0,1,6,1,16
"AT Rayudu, R Vinay Kumar",10,7,1,0,2,2,2,22
"S Dhawan, JH Kallis",7,11,3,0,2,3,2,26
"MEK Hussey, MJ McClenaghan",5,2,0,0,1,0,1,8
"DJ Hussey, ST Jayasuriya",5,1,0,0,1,0,1,7
"V Sehwag, BW Hilfenhaus",13,3,1,0,2,1,2,20
"TM Head, S Nadeem",0,2,0,0,0,0,0,2
"A Kumble, SK Warne",1,1,0,0,1,0,0,3
"M Vijay, CJ Jordan",1,4,0,0,4,0,0,9
"AC Gilchrist, SB Wagh",0,1,0,0,0,0,0,1
"SP Goswami, B Lee",0,1,0,0,0,0,0,1
"SPD Smith, MG Johnson",9,4,0,0,2,0,2,15
"SK Raina, Imran Tahir",3,4,2,0,2,0,0,11
"Y Nagar, A Kumble",4,5,0,0,0,0,1,9
"M Kartik, MM Patel",2,1,0,0,0,0,0,3
"Q de Kock, JJ Bumrah",0,1,0,0,0,0,0,1
"SV Samson, AD Russell",3,6,0,0,4,0,1,13
"MK Pandey, P Awana",4,6,2,0,2,2,0,17
"RS Bopara, M Morkel",2,1,0,0,0,0,1,3
"Vishnu Vinod, AR Patel",1,1,0,0,0,0,0,2
"PR Shah, S Sreesanth",1,0,2,0,0,0,1,3
"KH Pandya, Z Khan",5,5,2,0,3,1,0,16
"AR Patel, R Bhatia",0,2,1,0,0,0,0,3
"AC Thomas, Z Khan",1,2,0,0,1,0,0,4
"KA Pollard, A Singh",3,0,1,0,0,0,0,4
"MS Dhoni, NM Coulter-Nile",6,1,0,0,0,2,1,9
"SPD Smith, V Pratap Singh",1,2,0,0,0,0,0,3
"AM Rahane, AF Milne",5,4,0,0,2,0,0,11
"CH Morris, Imran Tahir",1,1,0,0,0,1,0,3
"R Dravid, SC Ganguly",2,6,0,0,1,0,1,9
"Mandeep Singh, JD Ryder",2,3,2,0,0,0,1,7
"SK Raina, RJ Harris",5,2,0,0,0,0,1,7
"KC Sangakkara, AM Nayar",0,2,1,0,1,0,0,4
"BJ Rohrer, Azhar Mahmood",1,3,0,0,2,2,0,8
"BCJ Cutting, SP Narine",2,2,0,0,0,0,0,4
"SC Ganguly, YK Pathan",12,20,1,1,5,0,0,39
"RA Jadeja, M Kartik",6,6,0,0,1,1,0,14
"D Wiese, MM Sharma",2,3,0,0,1,1,1,7
"PA Patel, DJ Muthuswami",4,1,0,1,0,0,0,6
"I Sharma, Z Khan",0,1,0,0,1,0,0,2
"SR Watson, SE Bond",3,2,0,0,2,0,0,7
"NV Ojha, S Kaushik",1,1,0,0,0,0,0,2
"CH Gayle, JE Taylor",0,2,0,0,0,0,0,2
"NM Coulter-Nile, TS Mills",0,1,0,0,0,0,0,1
"V Sehwag, GB Hogg",5,7,2,0,2,1,2,17
"AB de Villiers, MM Sharma",5,2,3,0,2,4,1,16
"M Vijay, Mohammed Shami",1,1,0,0,2,0,0,4
"TM Dilshan, AB Dinda",11,6,0,0,4,0,2,21
"DA Miller, M Morkel",7,6,0,0,0,0,0,13
"CH Morris, M Morkel",0,2,0,0,0,0,0,2
"MC Juneja, BA Bhatt",2,2,0,0,0,0,0,4
"M Vohra, B Stanlake",4,6,0,0,0,1,0,11
"AM Nayar, JD Ryder",7,8,0,0,2,0,1,17
"V Sehwag, VS Malik",6,0,0,0,3,2,0,11
"Ishan Kishan, SL Malinga",6,3,0,0,0,1,0,10
"P Kumar, J Botha",1,2,0,0,0,0,0,3
"V Sehwag, Shahid Afridi",0,3,1,0,0,1,0,5
"CA Pujara, MM Sharma",0,1,0,0,0,0,0,1
"DT Christian, WD Parnell",0,2,0,0,0,0,0,2
"MP Stoinis, Z Khan",2,2,2,0,0,0,1,6
"MS Dhoni, RS Bopara",3,5,0,0,3,0,0,11
"KV Sharma, S Kaul",2,1,0,0,1,0,0,4
"S Anirudha, SR Watson",0,1,0,0,1,1,0,3
"SA Yadav, YS Chahal",7,9,1,0,2,0,0,19
"CL White, WD Parnell",1,1,0,0,1,0,1,3
"RA Jadeja, RG Sharma",3,9,0,0,0,0,0,12
"IR Jaggi, Harbhajan Singh",1,0,0,0,0,0,1,1
"R Vinay Kumar, M Ashwin",1,1,0,0,0,0,0,2
"PP Chawla, MM Sharma",1,1,0,0,0,0,1,2
"MV Boucher, DL Vettori",3,8,2,0,1,0,0,14
"R Dravid, DL Vettori",15,21,3,0,3,0,1,42
"SPD Smith, VR Aaron",4,0,0,0,2,1,0,7
"Y Nagar, AM Nayar",1,1,0,0,1,1,1,4
"MS Dhoni, DL Vettori",12,13,1,0,2,0,1,28
"SS Iyer, SP Narine",5,8,1,0,0,0,0,14
"N Rana, SP Narine",1,3,0,0,0,0,0,4
"MC Henriques, J Suchith",2,1,0,0,0,0,1,3
"WP Saha, Mohammed Shami",7,1,0,0,3,1,2,12
"AC Gilchrist, M Morkel",27,6,0,0,3,2,1,38
"AR Patel, Rashid Khan",0,2,0,0,0,0,0,2
"DA Miller, DL Vettori",2,2,0,0,0,0,0,4
"S Rana, DW Steyn",1,1,1,0,1,0,0,4
"SM Katich, Joginder Sharma",1,3,0,0,0,1,0,5
"SR Tendulkar, RE van der Merwe",7,7,2,0,0,1,0,17
"SK Raina, Y Venugopal Rao",0,2,0,0,1,0,0,3
"SR Tendulkar, S Tyagi",3,2,0,0,2,0,0,7
"CH Morris, NLTC Perera",0,1,0,0,2,2,0,5
"JH Kallis, Shoaib Malik",2,1,0,0,0,0,0,3
"RJ Quiney, JA Morkel",3,4,0,0,2,0,0,9
"BJ Hodge, BE Hendricks",1,0,1,0,2,2,0,6
"BB McCullum, TG Southee",3,3,0,0,2,1,0,9
"AJ Finch, B Kumar",6,4,3,0,0,0,1,13
"SN Khan, TG Southee",1,1,2,0,0,0,0,4
"S Badrinath, AJ Finch",0,3,0,0,1,0,0,4
"CA Lynn, A Choudhary",3,0,0,0,2,1,0,6
"S Badree, AR Patel",1,0,0,0,0,0,1,1
"DJ Hussey, VY Mahesh",1,4,0,0,0,0,0,5
"MS Dhoni, Anureet Singh",3,5,2,0,1,2,0,13
"B Chipli, JD Unadkat",2,2,0,0,1,0,0,5
"Z Khan, P Negi",0,2,0,0,0,0,0,2
"CL White, RV Gomez",2,2,0,0,0,0,0,4
"BB McCullum, MS Gony",3,1,0,0,2,1,0,7
"R Dravid, Sohail Tanvir",0,1,1,0,0,0,0,2
"MK Tiwary, M Morkel",12,4,1,0,2,1,4,20
"SW Billings, Imran Tahir",2,2,0,0,0,0,1,4
"AB de Villiers, SS Sarkar",0,0,0,0,1,0,0,1
"SS Tiwary, TL Suman",4,3,3,0,0,0,0,10
"RG Sharma, SL Malinga",2,2,1,0,0,0,1,5
"V Kohli, Harbhajan Singh",14,36,2,0,2,5,0,59
"NM Coulter-Nile, UT Yadav",0,1,0,0,0,0,0,1
"HH Gibbs, SB Jakati",2,0,1,0,0,0,1,3
"DR Smith, B Kumar",29,7,1,0,6,2,3,45
"KD Karthik, SB Jakati",6,4,2,0,3,1,2,16
"V Kohli, AB McDonald",0,3,0,0,2,1,0,6
"S Badrinath, SL Malinga",18,13,0,0,6,0,1,37
"Yuvraj Singh, S Randiv",8,5,1,0,1,0,0,15
"N Rana, CR Woakes",1,4,0,0,1,0,0,6
"RV Uthappa, DR Smith",3,4,0,0,0,0,1,7
"GJ Bailey, KA Pollard",2,5,0,0,1,0,0,8
"KS Williamson, CR Woakes",2,1,2,0,3,0,0,8
"Yashpal Singh, DJ Bravo",1,0,1,0,0,0,1,2
"MG Johnson, STR Binny",1,0,0,0,0,0,0,1
"Yuvraj Singh, SM Harwood",10,3,1,0,0,0,0,14
"RV Uthappa, Sandeep Sharma",18,7,4,0,9,0,1,38
"JA Morkel, RR Powar",1,0,0,0,0,0,0,1
"EJG Morgan, M Muralitharan",4,2,0,0,1,0,0,7
"M Vijay, TL Suman",3,2,0,0,0,0,1,5
"VS Yeligati, VRV Singh",1,0,1,0,0,0,0,2
"BB McCullum, Bipul Sharma",7,7,1,0,1,0,3,16
"SV Samson, AR Patel",6,17,1,0,0,0,1,24
"RR Sarwan, MS Gony",1,1,0,0,0,0,0,2
"KC Sangakkara, S Kaul",4,0,0,0,2,0,0,6
"AB de Villiers, AB Agarkar",3,0,1,0,1,0,0,5
"DJ Bravo, RE van der Merwe",3,8,5,0,0,2,0,18
"SM Pollock, B Geeves",2,1,0,0,0,0,0,3
"YK Pathan, Mohammed Siraj",0,1,0,0,0,0,0,1
"J Syed Mohammad, DE Bollinger",1,1,0,0,0,0,0,2
"CH Gayle, CJ Anderson",0,6,0,0,0,0,0,6
"Y Nagar, JD Unadkat",2,0,0,1,0,1,0,4
"RR Pant, SL Malinga",1,0,0,0,0,0,0,1
"TL Suman, BJ Hodge",2,2,1,0,0,1,0,6
"S Badrinath, RA Jadeja",0,2,1,0,0,0,0,3
"Mohammed Shami, HV Patel",0,0,0,0,2,0,0,2
"YK Pathan, BW Hilfenhaus",2,1,0,0,0,3,0,6
"SR Watson, RR Raje",4,1,0,0,2,0,1,7
"AD Mascarenhas, BAW Mendis",4,3,0,0,0,0,0,7
"DR Smith, M Morkel",0,1,0,0,1,0,0,2
"DA Warner, SB Wagh",3,2,1,0,0,0,0,6
"SW Tait, A Mishra",2,1,0,0,0,1,0,4
"B Chipli, RP Singh",7,2,0,1,2,0,1,12
"RT Ponting, AA Chavan",2,1,0,0,0,0,0,3
"DJ Bravo, Harmeet Singh",1,1,1,0,0,0,0,3
"S Badrinath, NLTC Perera",1,4,0,0,0,0,0,5
"SR Watson, DJG Sammy",1,4,0,0,1,0,0,6
"DA Warner, RP Singh",17,6,1,0,4,3,1,31
"S Badrinath, A Symonds",7,2,0,0,1,0,0,10
"AM Rahane, MM Patel",3,2,0,0,1,1,0,7
"MK Pandey, CH Morris",7,7,2,0,2,0,0,18
"DJ Hussey, JD Unadkat",0,3,1,0,0,0,0,4
"TA Boult, HH Pandya",3,1,1,0,0,0,0,5
"DA Miller, S Kaul",1,3,0,0,2,2,0,8
"PR Shah, AM Salvi",3,2,1,0,0,0,0,6
"HH Pandya, Mohammad Nabi",3,2,0,0,0,0,0,5
"AN Ahmed, Z Khan",3,3,0,0,0,0,0,6
"G Gambhir, CL White",2,3,0,0,0,0,0,5
"VY Mahesh, A Nehra",2,0,1,0,0,0,0,3
"DJG Sammy, HV Patel",3,0,0,0,0,1,1,4
"V Kohli, M Manhas",1,2,0,0,1,0,0,4
"RG Sharma, VY Mahesh",5,6,0,0,3,0,0,14
"AL Menaria, MS Gony",0,2,0,0,0,0,0,2
"LMP Simmons, SP Narine",0,1,0,0,0,0,0,1
"SA Yadav, RA Jadeja",14,7,0,0,1,0,1,22
"LRPL Taylor, A Ashish Reddy",1,2,2,0,0,0,1,5
"Mohammad Hafeez, P Amarnath",7,3,0,0,1,0,1,11
"M Manhas, AN Ahmed",1,0,0,0,0,0,1,1
"PA Patel, Harbhajan Singh",15,6,3,0,1,0,1,25
"R Vinay Kumar, DS Kulkarni",6,3,1,0,0,0,0,10
"AM Nayar, SK Warne",6,6,3,0,3,0,0,18
"LMP Simmons, B Kumar",19,7,1,0,1,0,1,28
"G Gambhir, S Nadeem",7,11,3,0,4,1,0,26
"F Behardien, YS Chahal",1,0,0,0,0,0,1,1
"G Gambhir, VR Aaron",18,14,2,0,5,1,1,40
"S Badree, Imran Tahir",1,1,0,0,0,0,1,2
"M Vijay, JA Morkel",4,4,1,0,1,0,0,10
"R Dravid, RE van der Merwe",3,1,1,0,2,0,1,7
"RJ Harris, SK Warne",1,1,0,0,0,0,1,2
"J Theron, P Awana",1,1,0,0,1,0,0,3
"DJ Bravo, R Dhawan",3,1,0,0,1,0,1,5
"WP Saha, Kuldeep Yadav",3,3,3,0,0,1,1,10
"ML Hayden, DS Kulkarni",3,7,1,0,3,0,0,14
"Y Nagar, KK Cooper",4,2,0,0,0,0,0,6
"A Mithun, PP Chawla",0,1,0,0,0,0,0,1
"Gurkeerat Singh, S Sreesanth",4,2,0,0,0,0,0,6
"G Gambhir, A Mishra",14,20,1,0,8,0,1,43
"WP Saha, SR Watson",2,5,1,0,0,1,1,9
"VR Aaron, Sandeep Sharma",1,1,0,0,0,0,0,2
"BA Stokes, JJ Bumrah",1,3,3,0,1,0,0,8
"Shakib Al Hasan, Mustafizur Rahman",3,2,1,0,0,0,0,6
"Z Khan, HH Pandya",4,1,0,0,0,0,0,5
"R Dhawan, NLTC Perera",0,1,2,0,0,1,0,4
"RS Bopara, P Kumar",10,12,1,0,7,3,1,33
"KD Karthik, KP Appanna",4,1,0,0,1,0,1,6
"IK Pathan, MM Patel",2,3,0,1,2,0,0,8
"B Chipli, WD Parnell",4,4,1,0,1,1,0,11
"RV Uthappa, SR Tendulkar",2,2,2,0,3,0,0,9
"EJG Morgan, HV Patel",2,1,2,0,0,0,0,5
"SN Thakur, AF Milne",1,0,0,0,0,0,1,1
"PA Patel, A Nehra",15,8,1,0,13,0,2,37
"SP Narine, RP Singh",3,1,0,0,1,0,0,5
"KL Rahul, R Dhawan",0,4,1,0,1,0,0,6
"MK Tiwary, AB Agarkar",4,7,1,1,1,1,0,15
"STR Binny, A Nehra",1,3,1,1,1,1,0,8
"S Dhawan, D Wiese",1,0,0,0,1,0,1,2
"SK Raina, RV Gomez",2,2,0,0,2,1,0,7
"AM Nayar, DNT Zoysa",2,2,0,0,2,1,1,7
"S Rana, A Nehra",1,2,0,0,0,0,0,3
"LA Pomersbach, Harbhajan Singh",0,1,0,0,0,0,0,1
"A Symonds, GD McGrath",3,0,0,0,2,0,0,5
"Q de Kock, A Mishra",2,3,1,0,0,0,0,6
"EJG Morgan, S Nadeem",3,3,0,0,1,0,1,7
"TM Dilshan, RG Sharma",3,9,2,0,0,0,0,14
"R Bhatia, Azhar Mahmood",0,2,0,0,0,0,0,2
"DS Lehmann, IK Pathan",4,3,0,0,0,0,1,7
"NV Ojha, R McLaren",2,2,0,0,2,0,0,6
"CM Gautam, MM Sharma",0,3,0,0,0,0,0,3
"P Sahu, CH Morris",1,2,0,0,0,0,0,3
"DJ Bravo, DL Vettori",1,0,0,0,0,0,1,1
"JA Morkel, DL Vettori",3,3,1,0,1,1,0,9
"YK Pathan, DT Christian",0,2,1,0,0,0,0,3
"BB McCullum, AG Murtaza",14,9,0,0,1,0,0,24
"JA Morkel, AB Agarkar",3,3,0,0,1,2,0,9
"MA Starc, DJ Bravo",4,4,0,0,0,0,0,8
"ML Hayden, JP Duminy",1,4,1,0,0,0,0,6
"KK Nair, A Nehra",0,1,0,0,0,0,0,1
"RR Pant, DJ Hooda",0,2,1,0,0,0,0,3
"CL White, R Bhatia",4,8,2,0,4,1,1,19
"RG Sharma, TG Southee",1,1,1,0,1,0,0,4
"G Gambhir, I Sharma",28,5,4,0,11,0,0,48
"SR Watson, A Mishra",23,19,2,0,1,4,2,49
"P Kumar, VRV Singh",1,3,2,0,0,0,0,6
"TM Dilshan, SL Malinga",27,11,4,0,6,3,2,51
"DA Miller, MM Patel",1,4,0,0,0,3,0,8
"RV Uthappa, AR Patel",19,16,8,0,6,1,2,50
"JH Kallis, Harmeet Singh",10,7,0,0,1,1,1,19
"V Sehwag, JH Kallis",11,12,1,0,10,1,2,35
"JD Ryder, R McLaren",4,1,0,0,4,0,1,9
"R Dhawan, M Morkel",2,0,0,1,1,0,0,4
"LRPL Taylor, YA Abdulla",3,1,0,0,0,1,1,5
"RA Jadeja, AR Patel",5,9,0,0,2,0,1,16
"SR Watson, S Nadeem",13,5,1,0,0,2,1,21
"TL Suman, AS Raut",0,1,0,0,0,0,0,1
"JP Duminy, JH Kallis",3,6,1,0,1,3,0,14
"EJG Morgan, DJ Bravo",8,12,0,0,2,0,1,22
"AG Murtaza, SR Watson",0,1,0,0,0,0,0,1
"AA Jhunjhunwala, ST Jayasuriya",1,4,2,0,0,0,0,7
"STR Binny, Harbhajan Singh",12,9,2,1,5,2,0,31
"M Muralitharan, Pankaj Singh",3,0,1,1,0,0,0,5
"SC Ganguly, JR Hopes",2,2,0,0,0,1,0,5
"M Vijay, KA Pollard",2,0,0,0,0,0,1,2
"BB McCullum, IK Pathan",28,12,3,0,5,0,1,48
"MK Pandey, BA Stokes",1,2,0,0,0,0,0,3
"UT Yadav, AD Mathews",0,2,1,0,0,0,0,3
"AM Rahane, P Kumar",35,20,0,0,6,0,1,61
"S Badrinath, I Sharma",1,2,1,0,1,1,0,6
"SA Asnodkar, SM Pollock",5,5,2,0,3,0,0,15
"SS Iyer, S Aravind",5,0,0,0,0,0,1,5
"AM Rahane, R Vinay Kumar",23,22,8,0,7,2,2,62
"RV Uthappa, RA Tripathi",0,2,0,0,1,0,0,3
"PA Patel, VS Malik",2,1,0,0,0,0,1,3
"A Chandila, R Vinay Kumar",1,1,0,0,0,0,0,2
"LJ Wright, CH Morris",3,1,0,0,0,0,0,4
"MC Henriques, Gurkeerat Singh",3,2,0,0,1,0,1,6
"MK Pandey, S Nadeem",8,15,1,1,3,0,2,28
"F du Plessis, P Sahu",3,7,2,0,2,0,0,14
"SB Bangar, AB Dinda",1,1,0,0,0,0,0,2
"RG Sharma, IK Pathan",21,14,5,0,7,3,2,50
"Mandeep Singh, SB Jakati",2,2,0,0,1,0,0,5
"Ankit Sharma, KW Richardson",0,1,1,0,0,0,0,2
"PA Patel, Sohail Tanvir",10,3,0,0,2,0,1,15
"RA Jadeja, HH Pandya",3,0,0,0,1,0,0,4
"A Chopra, Y Venugopal Rao",5,1,1,0,0,0,0,7
"R Dravid, Gagandeep Singh",3,4,1,0,2,0,0,10
"KA Pollard, S Tyagi",0,0,1,0,0,0,0,1
"S Badrinath, PJ Sangwan",7,2,0,0,4,1,0,14
"AJ Finch, NLTC Perera",1,0,0,0,0,0,1,1
"SP Goswami, AB Agarkar",5,3,1,0,3,0,1,12
"PA Patel, R McLaren",9,2,1,0,1,0,1,13
"MK Tiwary, Basil Thampi",4,2,0,0,1,0,1,7
"DB Ravi Teja, SL Malinga",7,3,0,1,1,0,3,12
"Misbah-ul-Haq, RP Singh",2,3,0,0,1,0,0,6
"IK Pathan, Z Khan",6,8,3,0,3,0,2,20
"KA Pollard, DJ Bravo",24,22,4,0,7,7,3,64
"LMP Simmons, S Aravind",8,4,1,0,1,0,0,14
"YS Chahal, BCJ Cutting",1,1,0,0,0,0,0,2
"KL Rahul, Azhar Mahmood",2,0,0,0,2,0,1,4
"ML Hayden, R Bhatia",2,1,0,0,3,2,0,8
"SW Billings, B Kumar",3,1,0,0,0,0,0,4
"GJ Maxwell, Yuvraj Singh",2,1,0,0,1,2,0,6
"K Rabada, MG Johnson",1,1,0,0,0,0,0,2
"A Nehra, VRV Singh",1,1,0,0,0,0,0,2
"Gurkeerat Singh, PP Ojha",1,1,0,0,0,0,0,2
"R Vinay Kumar, B Kumar",1,0,0,0,0,0,1,1
"S Badrinath, A Mishra",9,10,2,0,1,0,0,22
"S Dhawan, A Chandila",4,1,0,0,1,1,0,7
"A Symonds, SR Watson",10,4,0,0,2,0,0,16
"RA Jadeja, Ankit Sharma",1,1,0,0,1,2,0,5
"AC Voges, JA Morkel",1,1,1,0,0,0,1,3
"HH Gibbs, VRV Singh",0,3,0,1,0,0,0,4
"KK Nair, NLTC Perera",8,3,0,0,0,0,0,11
"KV Sharma, KK Cooper",1,1,2,0,0,0,0,4
"CA Lynn, SK Trivedi",1,1,0,0,0,0,1,2
"KD Karthik, AR Patel",7,18,2,0,3,0,1,30
"BB McCullum, MR Marsh",0,2,0,0,1,0,0,3
"KS Williamson, Z Khan",3,6,0,0,2,0,0,11
"UBT Chand, S Sreesanth",6,1,0,0,2,0,1,9
"MC Henriques, TG Southee",4,1,0,0,0,0,1,5
"MEK Hussey, P Awana",6,4,2,0,4,0,0,16
"BB McCullum, PV Tambe",8,4,0,0,1,2,1,15
"AJ Tye, AR Patel",0,1,1,0,1,1,0,4
"AP Tare, JH Kallis",2,1,0,0,1,0,1,4
"MK Tiwary, A Singh",5,5,0,0,1,0,0,11
"CL White, CH Gayle",1,1,0,0,0,0,0,2
"BA Bhatt, SP Narine",1,0,0,0,0,1,0,2
"Shakib Al Hasan, CH Morris",3,0,0,0,0,0,1,3
"SR Watson, S Narwal",4,2,0,0,2,0,0,8
"Mandeep Singh, PJ Cummins",2,0,0,0,2,0,1,4
"DB Ravi Teja, GD McGrath",0,3,0,0,0,1,0,4
"MK Tiwary, A Flintoff",3,1,0,0,0,0,0,4
