key,0s,1s,2s,3s,4s,6s,outs,balls
"DH Yagnik, JO Holder",2,1,0,0,1,0,0,4
"S Kaushik, Sachin Baby",1,0,0,0,0,0,1,1
"SB Styris, MS Gony",2,5,0,0,1,0,0,8
"JH Kallis, S Tyagi",1,2,0,0,0,0,0,3
"AM Rahane, JD Unadkat",7,4,1,0,1,1,1,14
"PP Chawla, KA Pollard",4,0,0,0,0,0,0,4
"KW Richardson, SL Malinga",1,3,0,0,0,0,0,4
"AC Gilchrist, JP Duminy",9,6,1,0,1,0,0,17
"J Botha, ST Jayasuriya",1,2,0,0,0,0,0,3
"MG Johnson, BW Hilfenhaus",0,1,0,0,0,0,0,1
"MC Juneja, Anand Rajan",2,3,2,0,0,0,0,7
"DJ Bravo, DP Nannes",3,1,0,0,1,1,1,6
"Niraj Patel, CRD Fernando",2,4,1,0,1,1,0,9
"SD Chitnis, J Theron",0,1,1,0,0,0,0,2
"MV Boucher, Harbhajan Singh",1,6,1,0,2,0,0,10
"FY Fazal, SB Jakati",1,2,0,0,0,0,1,3
"MN Samuels, SB Jakati",5,3,3,0,2,0,0,13
"AM Rahane, JD Ryder",0,1,0,0,0,0,0,1
"HM Amla, RD Chahar",3,3,0,0,0,0,1,6
"LA Carseldine, D du Preez",0,1,0,1,0,0,0,2
"GH Vihari, RP Singh",0,2,1,0,0,0,0,3
"MS Dhoni, S Nadeem",7,14,1,0,0,1,0,23
"PD Collingwood, CL White",3,0,1,0,1,2,0,7
"GH Vihari, KK Cooper",1,2,0,0,0,0,1,3
"M Morkel, DJ Bravo",0,1,0,0,0,0,0,1
"T Henderson, DW Steyn",2,0,0,0,0,0,0,2
"J Botha, R Bhatia",1,0,0,0,0,0,1,1
"Mandeep Singh, B Kumar",8,7,4,0,4,0,0,23
"PC Valthaty, S Sriram",0,1,0,0,0,0,0,1
"K Goel, JDP Oram",2,4,0,0,1,0,0,7
"KP Pietersen, SB Styris",1,2,0,0,0,0,0,3
"DJ Bravo, PP Chawla",27,9,0,0,6,2,2,44
"Yuvraj Singh, R Ashwin",20,16,2,0,1,3,0,42
"M Vohra, AD Russell",10,2,3,0,1,1,1,17
"S Badrinath, V Sehwag",1,4,1,0,0,0,0,6
"KA Pollard, RE van der Merwe",0,2,1,0,0,1,0,4
"DT Christian, MG Johnson",0,0,2,0,0,0,0,2
"JP Duminy, Anureet Singh",3,1,0,0,1,0,0,5
"Yashpal Singh, A Mishra",1,1,0,0,0,0,1,2
"VR Aaron, L Balaji",4,5,0,0,1,1,0,11
"AB de Villiers, TA Boult",1,0,0,0,1,0,1,2
"RG Sharma, Sandeep Sharma",11,4,1,0,3,0,2,19
"V Sehwag, DJG Sammy",1,0,0,0,0,0,1,1
"JH Kallis, DR Smith",6,7,0,0,2,0,1,15
"GJ Maxwell, SS Agarwal",4,3,0,0,0,2,0,9
"YV Takawale, Sohail Tanvir",11,3,0,0,0,0,0,14
"BB Samantray, Sandeep Sharma",1,0,0,0,0,0,1,1
"RR Sarwan, P Amarnath",0,2,1,0,0,0,0,3
"PA Patel, BB Sran",8,1,0,0,2,0,1,11
"LRPL Taylor, CK Langeveldt",2,3,1,0,0,0,1,6
"R McLaren, KAJ Roach",4,1,0,0,0,0,0,5
"KW Richardson, R Ashwin",2,0,0,0,2,1,0,5
"DJ Hooda, TS Mills",2,3,0,0,0,0,0,5
"IR Jaggi, JDP Oram",4,2,0,0,0,0,0,6
"S Rana, R Bhatia",2,1,0,0,0,0,0,3
"KA Pollard, AS Rajpoot",5,2,1,0,1,1,0,10
"SS Tiwary, Harbhajan Singh",6,16,1,0,2,2,1,27
"AA Jhunjhunwala, PJ Sangwan",8,5,0,0,1,0,0,14
"YK Pathan, Mohammed Shami",3,9,2,0,1,1,0,16
"S Badrinath, R McLaren",6,10,1,0,4,0,0,21
"NV Ojha, TG Southee",2,1,1,0,0,0,0,4
"BB McCullum, Z Khan",28,22,5,0,7,5,2,67
"WPUJC Vaas, SW Tait",2,1,0,0,0,0,0,3
"Yuvraj Singh, M Kartik",6,5,1,0,0,2,0,14
"YK Pathan, JEC Franklin",6,7,0,0,1,0,1,14
"GC Smith, BAW Mendis",3,1,0,0,0,0,1,4
"P Negi, CJ Jordan",3,1,0,0,0,0,0,4
"R Vinay Kumar, JP Faulkner",2,0,2,0,0,3,1,7
"V Kohli, RG Sharma",1,1,1,0,0,1,0,4
"MC Henriques, M Vijay",0,7,0,0,0,0,0,7
"B Chipli, JH Kallis",0,3,0,0,0,0,0,3
"AUK Pathan, PC Valthaty",2,1,0,0,0,1,1,4
"YK Pathan, KH Pandya",1,2,0,0,0,0,1,3
"J Botha, DW Steyn",9,5,0,0,2,0,1,16
"IK Pathan, RJ Peterson",1,0,0,0,0,0,1,1
"DJ Jacobs, DL Vettori",1,2,0,0,0,0,0,3
"KS Williamson, Imran Tahir",2,3,0,0,0,0,0,5
"P Negi, CJ Anderson",2,1,0,0,3,0,0,6
"R Ashwin, SP Narine",1,1,0,0,0,0,1,2
"A Ashish Reddy, MR Marsh",0,3,0,0,0,0,0,3
"JH Kallis, R Rampaul",10,4,1,0,1,0,0,16
"AD Mascarenhas, R Bhatia",4,2,1,0,0,0,2,7
"B Kumar, DW Steyn",1,0,0,0,0,0,1,1
"KC Sangakkara, J Botha",10,9,0,0,2,0,2,21
"DB Das, P Awana",1,1,0,0,0,0,0,2
"WP Saha, Azhar Mahmood",1,0,0,0,0,0,0,1
"YK Pathan, CR Brathwaite",1,1,0,0,0,0,1,2
"V Kohli, Harmeet Singh",7,4,3,0,2,0,0,16
"DB Das, DS Kulkarni",4,1,0,0,1,0,0,6
"S Badrinath, JH Kallis",6,7,0,0,1,0,1,14
"SK Raina, DP Vijaykumar",4,3,0,0,3,1,0,11
"DL Vettori, A Mithun",0,2,0,0,0,0,0,2
"MR Marsh, R Vinay Kumar",6,4,0,0,0,0,1,10
"KH Pandya, KC Cariappa",1,1,0,1,0,0,0,3
"J Syed Mohammad, Harbhajan Singh",3,2,0,0,0,0,0,5
"UT Khawaja, Parvez Rasool",2,0,1,0,1,1,0,5
"CH Gayle, RN ten Doeschate",1,1,1,0,0,1,0,4
"M Kaif, Shahid Afridi",1,2,0,0,0,0,1,3
"Y Venugopal Rao, AG Murtaza",0,3,0,0,1,0,0,4
"P Kumar, MR Marsh",0,1,0,0,0,0,0,1
"M Manhas, R Dhawan",1,1,0,0,0,1,0,3
"R Dravid, C Nanda",1,3,2,0,0,0,0,6
"A Mishra, D Wiese",0,1,0,0,0,0,0,1
"I Sharma, FH Edwards",2,0,0,0,0,0,0,2
"SA Asnodkar, DS Kulkarni",3,3,0,0,0,1,0,7
"MC Henriques, Harmeet Singh",0,2,0,0,0,0,0,2
"SK Raina, SR Watson",12,15,2,0,7,1,2,37
"KB Arun Karthik, PC Valthaty",0,2,0,0,0,0,0,2
"JH Kallis, SB Bangar",3,2,0,0,1,0,0,6
"RA Jadeja, A Kumble",2,2,0,0,0,0,1,4
"GJ Bailey, M Morkel",7,3,0,0,1,1,0,12
"DA Miller, KMDN Kulasekara",0,2,0,0,1,0,0,3
"MF Maharoof, L Ablish",2,0,0,0,0,0,1,2
"AM Nayar, R Rampaul",5,1,0,0,1,0,0,7
"KH Pandya, B Kumar",6,2,4,0,2,0,1,14
"R Dravid, P Kumar",18,4,1,0,6,0,1,29
"EJG Morgan, HH Pandya",1,2,0,0,0,0,0,3
"NLTC Perera, Sandeep Sharma",1,2,0,0,0,0,1,3
"B Chipli, Harbhajan Singh",3,2,0,0,0,0,0,5
"AP Tare, S Ladda",1,1,0,0,0,0,0,2
"UT Yadav, MM Sharma",0,2,0,0,0,0,0,2
"DB Das, AN Ahmed",1,1,0,0,0,0,0,2
"AP Tare, Imran Tahir",2,0,0,0,1,0,1,3
"MEK Hussey, IK Pathan",13,12,2,1,7,2,2,37
"SC Ganguly, R Vinay Kumar",11,4,1,0,1,0,3,17
"VVS Laxman, GD McGrath",0,1,0,0,0,0,0,1
"R Vinay Kumar, Harbhajan Singh",3,1,0,0,0,0,1,4
"KV Sharma, BW Hilfenhaus",0,0,1,0,0,2,0,3
"N Rana, Z Khan",0,1,0,0,0,0,0,1
"NLTC Perera, P Awana",5,5,0,0,0,1,0,11
"JDP Oram, R Bhatia",1,2,0,0,0,0,0,3
"KL Rahul, KA Pollard",2,7,1,0,1,1,0,12
"UBT Chand, R Sharma",2,1,1,0,1,0,1,5
"MA Agarwal, Pankaj Singh",8,3,0,0,4,0,1,15
"RR Rossouw, JJ Bumrah",0,2,0,0,0,0,0,2
"KP Pietersen, MM Sharma",3,2,0,0,0,0,1,5
"Y Nagar, R Vinay Kumar",8,7,1,0,2,0,1,18
"N Saini, A Ashish Reddy",2,1,0,0,0,0,1,3
"GH Vihari, Mohammed Shami",6,1,0,0,0,0,0,7
"SV Samson, MM Sharma",15,4,2,0,2,1,1,24
"BAW Mendis, RP Singh",1,2,0,0,0,0,0,3
"R Dravid, JD Unadkat",1,5,1,0,2,0,0,9
"RV Gomez, DL Vettori",3,1,0,0,1,0,0,5
"KM Jadhav, AB Dinda",2,1,1,0,0,1,1,5
"Kamran Khan, A Kumble",1,0,0,0,0,0,1,1
"NJ Rimmington, WD Parnell",0,1,0,0,0,0,0,1
"Q de Kock, CJ Anderson",1,1,0,0,0,0,1,2
"STR Binny, R Dhawan",4,4,2,0,0,0,0,10
"SP Goswami, SC Ganguly",0,2,0,0,1,0,0,3
"S Badrinath, Shoaib Ahmed",0,1,1,0,0,0,0,2
"SV Samson, JJ Bumrah",9,5,2,0,4,0,0,20
"J Botha, R Vinay Kumar",0,1,0,0,1,0,0,2
"SK Raina, AD Russell",7,3,0,0,2,0,2,12
"A Symonds, V Kohli",3,3,1,0,0,1,0,8
"B Chipli, AB Dinda",5,1,0,1,1,0,0,8
"CH Gayle, AC Thomas",6,5,1,0,2,0,0,14
"V Sehwag, YS Chahal",4,6,2,0,0,0,2,12
"GR Napier, CH Gayle",3,2,2,0,1,0,1,8
"G Gambhir, S Narwal",4,1,2,0,1,0,1,8
"AD Russell, STR Binny",0,1,0,0,0,0,0,1
"KD Karthik, SK Warne",13,12,8,0,2,0,1,35
"DJ Harris, A Mithun",5,1,0,0,1,0,0,7
"A Nehra, MR Marsh",2,1,0,0,1,0,0,4
"HH Pandya, A Zampa",4,4,0,0,0,2,0,10
"AL Menaria, RP Singh",2,2,0,0,1,1,0,6
"Anureet Singh, Imran Tahir",0,2,0,0,0,1,0,3
"NV Ojha, CK Langeveldt",3,0,0,0,0,0,1,3
"AT Rayudu, P Kumar",16,10,2,0,5,1,0,34
"Gurkeerat Singh, DW Steyn",1,3,0,0,1,0,1,5
"MA Agarwal, DW Steyn",9,4,2,0,2,0,1,17
"IK Pathan, MM Sharma",0,2,0,0,0,0,0,2
"AM Rahane, P Awana",9,8,3,0,4,1,0,25
"G Gambhir, TG Southee",12,8,2,1,7,0,0,30
"P Kumar, SR Watson",6,2,0,0,1,0,0,9
"Harbhajan Singh, Anand Rajan",2,1,0,0,0,0,0,3
"CL White, MM Sharma",2,0,0,0,0,0,1,2
"RV Uthappa, RN ten Doeschate",1,2,0,0,0,0,0,3
"MM Patel, AB Dinda",1,1,0,0,0,0,0,2
"MS Dhoni, CJ Anderson",1,4,1,0,1,0,0,7
"AB Barath, RG Sharma",2,1,0,0,1,0,0,4
"DB Ravi Teja, SK Trivedi",4,4,1,0,0,0,0,9
"UT Khawaja, STR Binny",0,0,0,0,1,0,0,1
"DW Steyn, VRV Singh",0,1,0,0,0,0,0,1
"AM Rahane, Sandeep Sharma",26,13,3,0,4,0,2,46
"A Symonds, I Sharma",7,7,1,0,1,0,1,16
"PA Patel, DP Vijaykumar",6,1,0,0,1,0,1,8
"M Kaif, Mohammad Asif",1,1,0,0,0,0,0,2
"OA Shah, Shakib Al Hasan",1,4,1,0,1,0,0,7
"BJ Hodge, B Kumar",4,4,1,0,3,0,0,12
"S Sreesanth, DS Kulkarni",1,0,0,0,0,0,1,1
"RR Pant, JJ Bumrah",6,1,1,0,0,0,3,8
"DJ Hussey, DT Christian",0,1,0,0,0,1,0,2
"LA Pomersbach, SR Watson",0,1,0,0,0,0,0,1
"YV Takawale, YK Pathan",2,1,1,0,1,0,0,5
"KD Karthik, B Kumar",10,15,2,0,2,0,0,29
"P Kumar, JA Morkel",2,4,1,0,0,0,1,7
"JH Kallis, S Dhawan",1,2,0,0,0,0,0,3
"W Jaffer, Shahid Afridi",3,2,0,0,2,0,0,7
"MS Wade, A Mithun",1,1,1,0,0,0,1,3
"YK Pathan, JJ Bumrah",4,4,0,0,0,1,0,9
"AB de Villiers, I Sharma",9,10,0,0,1,2,0,22
"MJ McClenaghan, I Sharma",0,2,0,0,0,0,0,2
"M Vohra, JJ Bumrah",4,3,0,0,2,0,1,9
"M Vohra, Ankit Sharma",3,3,3,0,0,0,1,9
"SPD Smith, D Wiese",4,9,1,0,2,0,1,16
"JH Kallis, JP Faulkner",5,2,0,0,0,0,0,7
"B Chipli, S Sreesanth",1,0,0,0,0,0,0,1
"GJ Maxwell, MC Henriques",1,1,0,0,0,0,1,2
"N Saini, J Botha",2,1,0,0,0,0,0,3
"Mandeep Singh, MM Patel",2,2,0,0,3,0,0,7
"DA Miller, SK Raina",0,2,0,0,0,0,0,2
"VVS Laxman, ST Jayasuriya",1,3,0,0,0,0,0,4
"M Klinger, M Morkel",2,2,0,0,0,0,1,4
"HV Patel, TA Boult",2,0,1,0,0,0,1,3
"OA Shah, Jaskaran Singh",2,2,1,0,0,1,0,6
"HH Gibbs, Y Nagar",2,1,0,0,0,0,1,3
"MN Samuels, P Kumar",12,2,1,0,1,0,0,16
"MA Agarwal, D Wiese",1,4,0,0,0,0,0,5
"AT Rayudu, SJ Srivastava",5,1,0,0,1,0,2,7
"TM Dilshan, A Symonds",9,2,1,0,3,0,1,15
"AB Agarkar, T Henderson",2,2,0,0,0,0,0,4
"JP Duminy, B Kumar",10,6,3,0,1,1,1,21
"AB de Villiers, YK Pathan",1,11,0,0,0,2,0,14
"KW Richardson, MG Johnson",6,1,0,0,0,0,1,7
"Yuvraj Singh, R Dhawan",14,8,1,0,2,1,1,26
"KD Karthik, M Morkel",20,8,1,0,7,0,2,36
"RR Pant, DR Smith",1,6,1,0,2,0,0,10
"TR Birt, P Parameswaran",1,1,0,0,2,0,0,4
"MC Henriques, NM Coulter-Nile",1,3,0,0,1,0,0,5
"MF Maharoof, JR Hopes",1,0,0,0,0,0,1,1
"NLTC Perera, MC Henriques",0,1,0,0,0,1,0,2
"AD Mathews, TG Southee",0,3,0,0,1,0,0,4
"GC Smith, GD McGrath",17,2,1,0,3,0,0,23
"AP Tare, A Uniyal",1,1,2,0,1,1,0,6
"CA Pujara, A Mishra",4,7,1,0,1,0,0,13
"JP Faulkner, Karanveer Singh",0,2,2,0,0,0,0,4
"KS Williamson, BA Stokes",1,1,0,0,2,1,1,5
"RN ten Doeschate, SK Raina",3,1,0,0,0,0,0,4
"SS Tiwary, K Goel",1,1,0,0,0,0,0,2
"DP Nannes, WPUJC Vaas",1,1,0,0,0,0,0,2
"RR Pant, KV Sharma",1,3,1,0,1,0,0,6
"AD Mathews, AD Mascarenhas",2,2,0,0,2,0,0,6
"CJ Ferguson, J Botha",2,1,0,0,0,0,1,3
"KH Pandya, SN Thakur",1,1,0,0,0,0,1,2
"BB McCullum, SN Thakur",6,5,0,0,2,0,1,13
"Harbhajan Singh, A Mithun",0,2,0,0,1,1,0,4
"M Vijay, B Kumar",24,13,1,0,5,0,1,43
"AP Majumdar, A Chandila",3,0,0,0,0,0,1,3
"YK Pathan, SE Bond",1,3,1,0,2,0,0,7
"PA Patel, WD Parnell",6,3,1,0,2,0,1,12
"P Negi, UT Yadav",5,2,1,0,1,0,1,9
"I Sharma, DJ Bravo",1,1,0,0,1,0,0,3
"AJ Finch, R Shukla",1,0,0,0,0,0,1,1
"R Sharma, CH Gayle",1,0,0,0,0,0,0,1
"DW Steyn, M Morkel",2,0,1,0,0,0,1,3
"Y Venugopal Rao, RR Raje",0,2,1,0,1,0,0,4
"AB de Villiers, A Singh",1,3,2,0,1,0,0,7
"SV Samson, MS Gony",1,1,0,0,1,1,0,4
"AP Tare, SW Tait",7,0,0,0,2,0,0,9
"DB Ravi Teja, MM Patel",1,0,0,0,0,0,0,1
"KC Sangakkara, MR Marsh",11,6,0,0,5,0,0,22
"M Manhas, MG Johnson",0,1,0,0,0,0,0,1
"G Gambhir, Karanveer Singh",1,0,0,0,0,0,1,1
"JP Duminy, PC Valthaty",1,8,0,0,0,0,0,9
"MS Bisla, CH Morris",1,0,0,0,4,0,0,5
"Bipul Sharma, JO Holder",0,1,0,0,0,0,0,1
"MC Henriques, DT Christian",2,2,1,0,0,0,0,5
"NLTC Perera, A Chandila",3,0,0,0,1,0,1,4
"T Thushara, SK Trivedi",1,2,0,0,0,0,0,3
"MK Pandey, R Bhatia",4,8,2,0,0,1,0,15
"MK Tiwary, MN Samuels",0,1,0,0,1,0,0,2
"AJ Finch, CH Morris",7,2,0,0,3,0,0,12
"S Dhawan, JO Holder",12,9,3,0,2,1,0,27
"SV Samson, Anureet Singh",1,2,0,1,1,0,0,5
"AR Patel, DJ Bravo",4,4,2,0,0,1,2,11
"M Vijay, KW Richardson",1,1,0,0,1,0,0,3
"YK Pathan, YS Chahal",10,7,2,0,0,0,2,19
"KH Pandya, Imran Tahir",1,6,2,1,4,2,0,16
"YK Pathan, PV Tambe",3,3,1,0,1,0,1,8
"AT Rayudu, AC Thomas",6,1,0,0,1,0,1,8
"HM Amla, DS Kulkarni",7,5,2,0,0,1,0,15
"NLTC Perera, DS Kulkarni",3,1,0,0,0,0,0,4
"AS Raut, FH Edwards",0,3,0,0,1,0,0,4
"YK Pathan, DJ Hooda",0,1,0,0,1,0,0,2
"BJ Hodge, R Sharma",4,7,0,0,1,0,1,12
"RV Uthappa, YS Chahal",8,13,2,0,2,1,1,26
"Y Venugopal Rao, SL Malinga",3,5,2,0,0,0,2,10
"DB Ravi Teja, R Sharma",0,2,0,0,0,0,0,2
"JP Duminy, JJ Bumrah",6,14,4,0,3,6,1,33
"SL Malinga, NM Coulter-Nile",1,0,0,0,0,0,0,1
"BB McCullum, A Nehra",19,6,0,0,4,1,1,30
"JJ Bumrah, SN Thakur",0,2,0,0,0,0,0,2
"SM Pollock, GD McGrath",2,3,2,0,2,0,0,9
"DJ Bravo, L Balaji",0,3,0,0,0,2,0,5
"JH Kallis, PP Chawla",14,19,2,1,2,0,0,38
"JD Ryder, Ankit Sharma",2,1,0,0,1,0,1,4
"MC Henriques, TM Head",0,2,0,0,0,1,0,3
"SP Narine, TS Mills",1,1,0,0,0,0,0,2
"Gurkeerat Singh, KV Sharma",0,4,0,0,0,0,0,4
"AJ Finch, Mustafizur Rahman",6,3,2,0,0,1,0,12
"JDS Neesham, Karanveer Singh",6,1,1,0,0,0,1,8
"LRPL Taylor, MG Johnson",5,0,0,0,1,0,0,6
"AA Jhunjhunwala, Azhar Mahmood",1,2,0,0,0,0,0,3
"KD Karthik, AL Menaria",2,1,0,0,0,0,0,3
"J Theron, R Vinay Kumar",0,1,0,0,0,0,0,1
"S Dhawan, RG More",0,1,0,0,1,0,0,2
"SR Tendulkar, RR Powar",1,2,0,0,1,0,0,4
"AM Nayar, M Kartik",7,7,0,0,1,0,2,15
"PA Patel, GB Hogg",6,1,0,0,1,0,0,8
"AB Agarkar, UT Yadav",0,3,0,0,0,0,0,3
"M Morkel, RG Sharma",2,1,0,0,0,0,1,3
"Niraj Patel, A Nehra",2,1,0,0,1,0,0,4
"SS Tiwary, SB Jakati",8,8,1,0,1,0,2,18
"KD Karthik, Bipul Sharma",6,7,0,0,2,1,0,16
"C Madan, AB McDonald",1,0,0,0,0,0,1,1
"OA Shah, V Pratap Singh",1,3,1,0,1,0,0,6
"V Kohli, M Muralitharan",20,10,1,0,5,3,2,39
"AT Rayudu, Azhar Mahmood",0,2,0,0,1,0,0,3
"JEC Franklin, R Sharma",6,5,0,0,0,0,0,11
"SR Tendulkar, AB Dinda",25,7,1,0,11,1,0,45
"MS Bisla, AB Agarkar",2,1,1,0,0,0,1,4
"DT Christian, MJ McClenaghan",4,0,0,0,1,0,0,5
"DA Warner, MM Patel",3,6,0,0,1,0,0,10
"UBT Chand, M Kartik",4,6,1,0,1,0,0,12
"Harbhajan Singh, M Muralitharan",2,4,1,0,2,0,1,9
"AJ Finch, R Ashwin",13,10,1,0,0,1,0,25
"AD Mascarenhas, JD Ryder",1,0,0,0,0,0,0,1
"JEC Franklin, A Mishra",1,4,2,0,0,0,0,7
"NV Ojha, DW Steyn",12,4,0,2,1,0,0,19
"BJ Hodge, MM Patel",3,3,1,0,0,0,1,7
"KS Williamson, JP Duminy",1,1,0,0,0,0,0,2
"PP Chawla, P Kumar",1,0,0,0,0,0,1,1
"PA Patel, B Lee",6,5,0,0,2,0,1,13
"CJ Anderson, JJ Bumrah",0,1,0,0,0,0,0,1
"S Aravind, GJ Maxwell",3,2,0,0,0,0,1,5
"LRPL Taylor, PP Chawla",15,4,2,0,0,1,1,22
"MS Dhoni, DS Kulkarni",5,7,3,0,5,0,0,20
"AM Rahane, Rashid Khan",0,2,0,0,0,0,0,2
"Bipul Sharma, R Sharma",3,1,2,0,1,1,0,8
"Mohammad Hafeez, SM Pollock",5,3,0,0,0,0,1,8
"KC Sangakkara, SK Warne",3,6,1,0,1,1,1,12
"DR Smith, R McLaren",3,1,0,0,2,0,0,6
"WPUJC Vaas, PD Collingwood",1,2,0,0,0,0,1,3
"G Gambhir, KK Cooper",1,2,0,0,0,0,0,3
"DA Warner, Washington Sundar",12,8,1,0,3,0,0,24
"R Dhawan, P Negi",4,0,1,0,1,0,0,6
"TM Head, R Ashwin",1,1,0,0,0,0,0,2
"DJ Hussey, P Amarnath",1,0,0,0,0,0,1,1
"PP Ojha, UT Yadav",4,2,0,0,0,0,0,6
"A Symonds, AC Thomas",2,2,0,0,0,0,0,4
"HH Pandya, K Rabada",8,2,0,1,0,1,0,12
"AM Nayar, Y Venugopal Rao",1,6,1,0,0,1,0,9
"Y Venugopal Rao, R Vinay Kumar",10,9,1,0,3,0,1,23
"AR Patel, SR Watson",7,3,2,0,2,1,1,15
"KV Sharma, JO Holder",2,1,1,0,0,0,0,4
"VR Aaron, R Ashwin",2,0,0,0,0,0,0,2
"DT Patil, SK Trivedi",2,3,0,0,0,0,0,5
"AM Nayar, STR Binny",0,0,1,0,0,0,0,1
"KP Pietersen, DP Nannes",0,1,1,0,0,0,0,3
"UBT Chand, Harbhajan Singh",1,0,0,0,0,0,1,1
"MK Tiwary, RR Powar",5,12,2,0,0,1,0,20
"SK Raina, DW Steyn",9,14,0,0,3,0,0,26
"PA Patel, SB Wagh",5,2,0,0,2,0,0,9
"AS Raut, AM Nayar",2,2,0,0,0,0,0,4
"S Sohal, SL Malinga",13,0,1,0,3,0,0,17
"JP Duminy, S Gopal",1,2,0,0,0,1,0,4
"KK Nair, GS Sandhu",2,1,2,0,2,1,0,8
"MS Dhoni, D Wiese",3,5,2,0,1,0,1,11
"Harbhajan Singh, MA Starc",3,0,1,0,0,0,1,4
"PC Valthaty, KA Pollard",2,2,1,0,0,0,0,5
"IK Pathan, A Mishra",11,21,2,0,1,0,2,35
"AC Gilchrist, A Mithun",5,3,1,1,1,1,0,12
"MR Marsh, R Dhawan",1,3,0,0,0,0,0,4
"MM Patel, A Nehra",1,1,0,0,0,0,0,2
"JP Duminy, MR Marsh",1,7,0,0,0,0,1,8
"JR Hopes, GD McGrath",1,3,0,0,0,0,0,4
"SR Tendulkar, JP Duminy",2,1,0,0,0,0,0,3
"M Manhas, UT Yadav",0,1,1,0,1,0,0,3
"FY Fazal, Harmeet Singh",2,1,0,0,1,0,0,4
"MA Agarwal, R McLaren",4,0,0,0,0,0,1,4
"IK Pathan, SL Malinga",7,9,0,0,1,1,2,18
"G Gambhir, RP Singh",15,8,3,0,5,3,2,34
"L Balaji, A Mishra",4,1,0,0,0,0,1,5
"B Lee, AM Rahane",0,2,0,0,0,0,0,2
"R Rampaul, PV Tambe",2,2,1,0,0,1,1,6
"JC Buttler, R Ashwin",0,1,0,0,0,0,0,1
"KK Cooper, Imran Tahir",4,2,0,0,2,0,0,8
"P Kumar, KK Cooper",3,2,0,0,0,2,0,7
"HH Pandya, BA Stokes",1,5,0,0,0,0,0,6
"SP Narine, S Aravind",5,3,1,0,6,1,0,16
"BB McCullum, R Ashwin",23,14,1,1,1,1,3,41
"AM Nayar, A Kumble",1,1,1,0,0,0,0,3
"DA Miller, KK Cooper",6,4,1,0,0,0,1,11
"AB McDonald, P Kumar",6,1,1,0,0,1,0,9
"JP Faulkner, WD Parnell",0,1,1,0,0,0,0,2
"RR Pant, PJ Sangwan",3,1,0,0,2,2,0,8
"L Balaji, SL Malinga",1,0,0,0,0,0,1,1
"FY Fazal, S Sreesanth",6,3,0,0,0,0,0,9
"BJ Hodge, PP Chawla",13,11,1,1,2,0,1,28
"JH Kallis, B Lee",0,3,0,0,0,0,0,3
"LA Carseldine, FH Edwards",7,0,2,0,0,0,0,9
"SP Fleming, P Kumar",7,0,1,1,1,1,0,11
"RV Uthappa, CJ Anderson",3,4,0,0,0,1,1,8
"S Dhawan, CK Kapugedera",0,2,0,0,2,0,0,4
"CL White, DE Bollinger",2,4,0,0,0,0,0,6
"MV Boucher, RA Jadeja",2,3,0,0,0,0,1,5
"NV Ojha, JEC Franklin",0,2,0,0,1,0,0,3
"Bipul Sharma, SP Narine",1,1,0,0,0,0,1,2
"AT Rayudu, S Badree",1,3,0,0,1,0,0,5
"F du Plessis, B Lee",1,0,0,0,0,0,1,1
"P Kumar, YK Pathan",1,2,0,0,0,1,0,4
"YS Chahal, AR Patel",0,2,0,0,0,0,0,2
"PA Patel, Karanveer Singh",2,4,2,0,0,0,1,8
"JA Morkel, RA Jadeja",3,1,0,0,1,1,0,6
"SPD Smith, STR Binny",1,5,0,0,2,0,1,8
"C de Grandhomme, A Nehra",1,0,0,0,0,0,0,1
"Iqbal Abdulla, KK Cooper",1,1,0,0,0,0,0,2
"RG More, AD Russell",0,2,0,0,0,0,0,2
"A Mishra, GB Hogg",5,1,0,0,0,0,1,6
"PA Patel, Mohammad Hafeez",1,2,0,0,0,0,0,3
"PP Chawla, Harbhajan Singh",1,3,0,0,1,0,1,5
"DB Ravi Teja, IK Pathan",4,3,0,0,0,0,0,7
"JP Faulkner, JD Unadkat",2,0,0,0,0,0,1,2
"S Dhawan, MS Gony",6,5,0,0,1,0,1,12
"GJ Maxwell, TG Southee",3,3,1,0,1,1,0,9
"GC Smith, Harbhajan Singh",6,1,0,0,0,0,1,7
"WA Mota, JA Morkel",3,4,1,0,1,0,1,9
"SE Marsh, I Sharma",10,5,0,0,2,0,0,17
"MK Tiwary, JD Unadkat",3,4,1,0,2,0,0,10
"ML Hayden, AB Dinda",3,2,0,0,2,0,0,7
"TL Suman, DJ Bravo",7,0,1,0,0,1,1,9
"MK Pandey, MP Stoinis",1,0,0,0,0,1,0,2
"ML Hayden, DR Smith",2,2,0,0,2,1,0,7
"AC Voges, UT Yadav",3,2,1,0,1,0,0,7
"CJ Anderson, RA Jadeja",3,2,1,0,1,1,0,8
"DJ Harris, TM Dilshan",2,0,0,0,1,2,0,5
"SPD Smith, J Theron",2,2,0,0,0,1,1,5
"CJ Ferguson, BA Bhatt",2,1,0,0,0,0,0,3
"KP Pietersen, AC Voges",1,1,0,0,3,0,0,5
"SS Iyer, PJ Sangwan",3,2,0,0,3,1,0,9
"S Rana, SP Narine",0,1,0,0,0,0,0,1
"CA Lynn, S Kaushik",5,3,0,0,2,1,0,11
"SR Watson, DS Kulkarni",13,7,3,0,4,2,1,29
"AL Menaria, Iqbal Abdulla",3,3,0,0,1,2,0,9
"R Vinay Kumar, SL Malinga",3,7,1,0,0,0,1,11
"EJG Morgan, CR Brathwaite",0,1,0,0,0,0,0,1
"FY Fazal, DR Smith",2,2,0,0,0,0,0,4
"JP Faulkner, KC Cariappa",0,2,1,0,0,0,0,3
"KM Jadhav, DJ Hooda",1,0,0,0,0,0,0,1
"M Kaif, JM Kemp",2,0,0,0,0,0,0,2
"G Gambhir, Basil Thampi",0,1,0,0,0,0,0,1
"CL White, MS Gony",4,1,0,0,1,0,1,6
"NV Ojha, CR Woakes",1,3,2,0,0,0,0,6
"RD Chahar, AJ Tye",0,1,1,0,0,0,0,2
"PP Chawla, A Kumble",1,1,1,0,0,0,0,3
"K Rabada, KV Sharma",3,0,0,0,0,0,1,3
"SS Tiwary, BB Sran",1,1,0,0,0,0,0,2
"MA Agarwal, CH Morris",7,3,1,0,2,0,0,13
"SC Ganguly, RG Sharma",4,6,2,0,1,0,1,13
"KD Karthik, SMSM Senanayake",1,1,0,0,1,0,1,3
"Yuvraj Singh, Shoaib Ahmed",1,1,0,0,0,0,1,2
"V Sehwag, P Awana",6,4,1,0,1,0,2,12
"SA Asnodkar, IK Pathan",2,0,0,0,0,0,1,2
"M Vohra, MR Marsh",1,3,2,0,1,0,0,7
"M Kartik, SB Styris",0,1,0,0,0,0,0,1
"KM Jadhav, VR Aaron",6,2,0,0,1,0,1,9
"JR Hopes, A Mishra",2,5,1,0,2,0,1,10
"AM Nayar, Z Khan",1,2,0,0,0,0,0,3
"OA Shah, R McLaren",1,2,1,0,0,0,0,4
"Iqbal Abdulla, Harbhajan Singh",1,2,0,0,0,0,0,3
"Joginder Sharma, PP Ojha",1,2,0,0,0,0,0,3
"AT Rayudu, Anureet Singh",4,0,0,0,1,0,0,5
"JP Duminy, TM Dilshan",0,2,0,0,0,0,0,2
"NV Ojha, S Aravind",1,0,0,0,0,0,1,1
"RA Tripathi, P Negi",2,4,1,0,0,0,2,7
"BJ Hodge, V Kohli",2,2,0,0,1,0,0,5
"SM Katich, RG Sharma",3,0,0,0,0,0,1,3
"AM Nayar, RP Singh",3,2,1,0,0,1,1,7
"SR Watson, SMSM Senanayake",5,5,0,0,1,0,0,11
"SS Tiwary, AS Rajpoot",6,5,0,0,1,0,1,12
"AB Dinda, A Mishra",1,2,0,0,0,0,1,3
"R Bhatia, DW Steyn",4,1,0,0,1,0,1,6
"MS Bisla, WD Parnell",7,2,0,0,1,0,1,10
"Harbhajan Singh, SR Watson",2,3,0,0,2,1,0,8
"B Kumar, NM Coulter-Nile",1,2,1,0,1,0,0,5
"R Dravid, JE Taylor",3,1,0,0,0,0,0,4
"MK Tiwary, AB McDonald",1,0,0,0,0,0,1,1
"A Symonds, Y Nagar",1,2,0,0,2,1,0,6
"TM Dilshan, RR Powar",4,5,1,0,4,1,0,15
"MK Tiwary, PJ Sangwan",0,0,0,0,0,1,0,1
"Y Venugopal Rao, V Kohli",0,3,0,0,0,0,0,3
"Y Venugopal Rao, A Mishra",3,2,0,0,1,0,1,6
"MEK Hussey, DJ Hussey",3,6,1,0,0,0,0,10
"AB de Villiers, JJ Bumrah",14,14,4,0,1,4,2,37
"SV Samson, R Ashwin",2,0,0,0,0,0,0,2
"B Lee, ST Jayasuriya",3,1,0,0,0,0,0,4
"AN Ahmed, M Morkel",0,1,0,0,1,0,0,2
"Z Khan, JDP Oram",1,2,0,0,1,0,0,4
"Yuvraj Singh, VY Mahesh",1,5,0,0,1,0,0,7
"AL Menaria, MM Patel",5,1,0,0,1,0,0,7
"UBT Chand, Yuvraj Singh",0,3,0,0,0,0,0,3
"SP Goswami, CK Langeveldt",8,0,0,0,2,0,1,10
"M Vohra, RE van der Merwe",2,1,0,0,0,0,0,3
"KA Pollard, RP Singh",2,1,0,0,2,1,0,6
"B Chipli, P Kumar",2,1,0,0,0,0,0,3
"Parvez Rasool, AN Ahmed",0,2,0,0,0,0,0,2
"KAJ Roach, Harbhajan Singh",0,1,0,0,1,0,0,2
"BB McCullum, YK Pathan",3,2,0,0,0,0,0,5
"DJ Hooda, A Choudhary",0,2,1,0,0,1,0,4
"SW Billings, PP Chawla",1,3,3,0,2,0,0,9
"NV Ojha, R Dhawan",4,9,0,0,1,2,0,16
"Bipul Sharma, PP Ojha",0,2,0,0,1,0,0,3
"KV Sharma, SN Thakur",1,0,0,0,0,0,0,1
"AC Gilchrist, L Balaji",17,7,1,0,5,2,0,32
"PC Valthaty, YK Pathan",1,0,0,0,1,0,1,2
"MA Agarwal, L Balaji",1,2,0,0,0,0,1,3
"R Vinay Kumar, RJ Harris",4,2,1,0,1,0,2,8
"DA Warner, AB Dinda",21,12,4,0,3,3,2,43
"DA Warner, JJ Bumrah",9,15,0,0,4,1,0,29
"SS Tiwary, A Symonds",2,4,1,0,0,0,0,7
"A Singh, DE Bollinger",0,1,0,0,0,0,0,1
"RA Jadeja, BB Sran",1,6,2,0,0,0,0,9
"RV Uthappa, Harbhajan Singh",13,17,3,0,7,4,2,44
"TM Dilshan, M Kartik",5,6,1,0,0,0,0,12
"Y Nagar, A Singh",2,2,0,0,2,2,1,8
"JP Duminy, PP Chawla",5,17,2,0,0,2,1,26
"CA Pujara, PP Chawla",6,5,0,0,2,0,0,13
"SA Asnodkar, RG Sharma",0,1,0,0,0,0,0,1
"STR Binny, BA Stokes",0,1,0,0,1,0,0,2
"AJ Finch, Yuvraj Singh",4,8,1,0,1,0,1,14
"P Negi, P Kumar",1,5,0,0,0,0,0,6
"KP Pietersen, SP Narine",3,1,0,0,1,0,0,5
"SS Shaikh, SK Warne",0,1,0,0,1,0,0,2
"R Vinay Kumar, RN ten Doeschate",2,7,0,0,0,0,0,9
"DJ Bravo, V Sehwag",0,1,0,0,0,0,0,1
"M Vijay, Bipul Sharma",1,0,0,0,0,0,1,1
"DJ Hussey, S Ladda",0,1,0,0,0,0,0,1
"AP Tare, KK Cooper",5,1,1,0,1,0,2,8
"DJ Hooda, UT Yadav",0,0,0,0,1,0,0,1
"AP Tare, SR Watson",2,3,1,0,2,1,0,9
"N Rana, BA Stokes",7,3,0,0,0,1,0,11
"VVS Laxman, S Sreesanth",6,7,0,0,3,0,1,16
"R Ashwin, P Awana",0,1,0,0,0,0,0,1
"GH Vihari, JH Kallis",0,1,0,0,0,0,0,1
"PA Patel, PJ Cummins",1,1,0,0,2,0,0,4
"JR Hopes, JD Unadkat",4,3,0,0,1,0,0,8
"Y Nagar, HV Patel",2,2,0,0,1,0,0,5
"JD Ryder, A Chandila",1,1,0,0,0,0,1,2
"RA Jadeja, KP Pietersen",1,4,1,0,0,0,0,6
"EJG Morgan, AB McDonald",2,2,0,0,0,0,0,4
"SR Watson, P Awana",6,6,0,0,5,2,1,19
"A Symonds, CK Langeveldt",2,1,0,0,0,0,0,3
"KC Sangakkara, KA Pollard",6,11,1,0,4,0,0,22
"R McLaren, AB Dinda",2,0,0,0,0,0,0,2
"AC Gilchrist, S Narwal",2,1,0,0,0,0,1,3
"KK Nair, Yuvraj Singh",2,7,3,0,1,0,1,13
"DA Warner, AC Thomas",7,3,0,0,3,3,0,16
"AB de Villiers, SB Jakati",9,11,1,2,3,4,2,30
"MR Marsh, SK Raina",3,1,0,0,0,0,0,4
"RA Jadeja, Shahid Afridi",0,1,0,0,0,0,0,1
"KM Jadhav, I Sharma",4,5,1,0,2,1,1,13
"SK Raina, NLTC Perera",8,11,3,1,4,1,1,28
"SP Narine, Basil Thampi",2,0,0,0,2,1,0,5
"KC Sangakkara, A Mishra",2,5,0,0,0,0,0,7
"RG Sharma, YK Pathan",8,10,1,0,0,0,0,19
"AC Voges, ST Jayasuriya",0,4,0,0,1,0,0,5
"A Mishra, P Negi",2,3,0,0,0,1,1,6
"DJ Thornely, R Bhatia",1,1,0,0,0,1,1,3
"AB Agarkar, RA Jadeja",3,3,0,0,0,0,0,6
"S Dhawan, SJ Srivastava",1,1,0,0,0,0,0,2
"G Gambhir, P Negi",0,5,1,0,0,0,0,6
"Yuvraj Singh, S Kaul",4,3,0,0,0,1,0,8
"JP Duminy, PV Tambe",4,9,1,0,0,1,1,15
"SC Ganguly, P Amarnath",0,1,0,0,0,0,0,1
"DA Miller, DJG Sammy",4,3,0,0,1,0,1,8
"R Vinay Kumar, Shakib Al Hasan",5,6,1,0,0,0,2,12
"S Dhawan, HH Pandya",7,3,3,1,2,0,0,16
"V Sehwag, MM Sharma",13,5,3,0,4,1,2,26
"AB Dinda, SR Watson",1,0,0,0,0,0,1,1
"L Balaji, MA Starc",0,1,0,0,0,0,0,1
"PC Valthaty, Iqbal Abdulla",2,0,0,0,0,0,0,2
"YK Pathan, VY Mahesh",1,2,0,0,0,0,0,3
"AT Rayudu, S Randiv",1,1,0,0,0,0,1,2
"RJ Quiney, A Nehra",9,1,0,0,0,0,2,10
"JP Faulkner, GS Sandhu",0,0,2,0,1,0,0,3
"MK Pandey, Iqbal Abdulla",10,10,0,0,2,0,2,22
"SC Ganguly, J Theron",8,3,0,0,1,0,0,12
"SR Watson, Shahid Afridi",1,2,0,0,0,0,1,3
"SA Yadav, VR Aaron",2,2,0,0,0,0,0,4
"SK Warne, B Lee",0,1,0,0,0,0,0,1
"CJ Anderson, HV Patel",1,1,0,0,0,0,0,2
"J Botha, BE Hendricks",1,0,0,0,0,0,0,1
"MS Dhoni, MP Stoinis",5,3,0,0,0,0,0,8
"MA Agarwal, R Bhatia",0,4,0,0,0,0,0,4
"DJ Bravo, JD Unadkat",3,2,0,0,0,0,0,5
"WPUJC Vaas, I Sharma",0,1,0,0,0,0,0,1
"A Symonds, MB Parmar",2,4,0,0,3,0,0,9
"F du Plessis, PV Tambe",6,11,4,0,4,1,1,26
"RA Jadeja, CR Brathwaite",0,1,0,0,1,0,0,2
"KM Jadhav, Anureet Singh",1,2,0,0,0,0,0,3
"RA Jadeja, P Awana",4,1,1,0,2,0,2,8
"SS Tiwary, SR Watson",11,3,1,0,2,0,1,17
"STR Binny, PJ Cummins",1,2,0,0,1,0,0,4
"Y Venugopal Rao, RE van der Merwe",0,2,1,0,0,0,0,3
"T Taibu, PJ Sangwan",1,1,1,0,0,0,0,3
"KK Nair, Parvez Rasool",0,1,0,0,0,0,0,1
"SS Tiwary, KP Pietersen",5,6,0,0,0,0,0,11
"R Sathish, SR Watson",1,1,0,0,0,0,0,2
"R Tewatia, L Balaji",2,0,1,0,0,0,0,3
"SK Raina, WA Mota",3,1,0,0,0,0,2,4
"S Badrinath, CRD Fernando",2,0,0,0,0,0,1,2
"RA Tripathi, YS Chahal",0,2,0,0,2,0,0,4
"Mohammad Hafeez, M Muralitharan",3,4,0,0,0,0,0,7
"DA Miller, RP Singh",3,3,2,0,4,2,0,14
"S Badrinath, BJ Hodge",1,4,1,0,0,1,1,7
"CJ Anderson, AD Russell",5,4,0,0,0,1,0,10
"MK Pandey, K Rabada",2,0,0,0,0,0,1,2
"SS Iyer, Avesh Khan",2,3,0,0,0,0,0,5
"V Kohli, Yuvraj Singh",3,12,1,0,4,0,0,20
"A Symonds, A Mishra",17,12,7,0,1,5,3,42
"AD Mathews, DW Steyn",2,3,0,0,0,0,0,5
"S Badrinath, IK Pathan",11,9,2,0,1,2,1,25
"KL Rahul, Sandeep Sharma",1,3,1,0,2,0,0,7
"M Vijay, DT Christian",4,1,0,0,0,0,0,5
"PA Patel, PP Chawla",7,21,4,0,1,0,1,33
"KD Karthik, RR Powar",7,3,1,0,0,0,0,11
"C Madan, A Nehra",8,1,0,0,2,0,0,11
